sample_id,split,age_group,gender,situation_keyword,physical_disease,emotion_major,emotion_minor,service_label,text,persona_id,talk_id,emotion_code,situation_code,service_label_original,tired_heuristic_applied,tired_heuristic_reason
train-006476,train,청년,남성,"진로,취업,직장",해당없음,기쁨,편안한,CALM,회사에서 문제가 있었는데 잘 풀려서 마음이 편안해졌어. 맞아. 오늘 기분이 너무 좋고 편안해.,Pro_03834,Pro_03834_00037,E63,S06_D02,CALM,False,missing-fatigue-keyword
train-016844,train,중년,여성,건강,해당없음,당황,부끄러운,ANXIOUS,배가 나와서 옷 가게에서 옷이 다 맞지 않았어. 창피해서 가게를 나왔어. 갱년기가 오면서 체중도 늘어 살이 많이 쪘어. 이제는 빅 사이즈 옷 가게를 가 보려고.,Pro_08867,Pro_08867_00010,E56,S09_D02,ANXIOUS,False,missing-fatigue-keyword
train-006173,train,중년,여성,건강,해당없음,슬픔,낙담한,TIRED,회사 정기 검진에서 간에 이상이 생겼다는 소견이 나왔어. 어찌할 바를 모르겠네. 너무 빨리 피곤해져서. 의사가 심각한 건 아니라는데 요즘 술을 너무 많이 마신 게 마음에 걸리네. 술을 줄이고 퇴근하면 가벼운 운동을 시작하려고 초기일 때 관리하는 게 좋을 것 같아.,Pro_08839,Pro_08839_00029,E28,S09_D02,SAD,True,fatigue+physical-context
train-015613,train,청년,여성,대인관계,해당없음,분노,안달하는,ANXIOUS,이번 주말에 남자친구랑 여행가기로 했는데 준비할 생각을 안 해서 짜증 나. 여행 갈 생각이 있는 건지 없는 건지 모르겠어. 나보고 다 준비하라고 그러는건지 답답해. 오늘 저녁에 만나자고 해서 생각을 좀 들어봐야겠어.,Pro_05107,Pro_05107_00050,E16,S04_D02,ANXIOUS,False,missing-fatigue-keyword
train-034924,train,청년,남성,"연애,결혼,출산",해당없음,불안,스트레스 받는,TIRED,일 끝내고 피곤해서 쉬려고 하는데 여자친구가 놀아달라고 해서 힘들어. 내가 참고 놀아줄지 말지 고민이야. 아무래도 너무 힘드니까 놀지 못한다고 얘기해야겠어.,Pro_03683,Pro_03683_00029,E32,S05_D02,ANXIOUS,True,fatigue+physical-context
train-024643,train,노년,남성,대인관계,만성질환 무,기쁨,안도,CALM,지난 달에 아우가 건강검진을 받았다고 해서 걱정했는데 결과를 보니 다행이야. 특별히 이상 있는 곳이 없다고 하면서 술만 조금 줄이라고 했다고 해. 나이가 있으니 건강 문제는 수시로 챙겨야 해. 건강관리를 잘 해야지.,Pro_09838,Pro_09838_00011,E67,S04_D02,CALM,False,missing-fatigue-keyword
train-032726,train,청년,여성,대인관계,해당없음,기쁨,안도,CALM,새로 들어온 상사와 좋은 관계를 맺었어. 다행이야. 진심으로 대하려고 노력했어.,Pro_05158,Pro_05158_00020,E67,S04_D02,CALM,False,missing-fatigue-keyword
train-040057,train,노년,남성,대인관계,만성질환 무,슬픔,우울한,SAD,사람은 일단 유명해지라는 말이 맞아. 유명하거나 권력을 가진 사람이 하는 말은 힘을 가지지. 그래서 한 말인데. 예전에는 그래도 들어준 사람들이 있었는데 지금은 그렇지가 않고 정말 내 신세가 처량해.,Pro_09795,Pro_09795_00019,E24,S04_D02,SAD,False,missing-fatigue-keyword
train-039347,train,노년,여성,"건강,죽음",만성질환 무,불안,초조한,ANXIOUS,늙어서 걷기도 어렵고 치매로 정말 힘들어. 만성질환은 회복하기 어려워서 꾸준히 운동하고 있어. 계속 체력단련을 하면 다시 건강을 회복할 것 같아.,Pro_12210,Pro_12210_00010,E39,S11_D02,ANXIOUS,False,missing-fatigue-keyword
train-037617,train,청소년,남성,학교폭력/따돌림,해당없음,기쁨,만족스러운,HAPPY,우리 학교는 학교폭력과 따돌림이 없어서 정말 흡족해. 학교에 학교폭력과 따돌림이 존재하지않아야지.,Pro_00355,Pro_00355_00017,E64,S03_D02,HAPPY,False,missing-fatigue-keyword
train-010531,train,중년,여성,"재정,은퇴,노후준비",해당없음,기쁨,만족스러운,HAPPY,요즘 재정적으로 너무 만족스러워. 임대 수익도 쏠쏠하고 여기저기서 계속 돈 들어올 일이 자꾸 생기네.,Pro_08755,Pro_08755_00008,E64,S08_D02,HAPPY,False,missing-fatigue-keyword
train-006997,train,중년,여성,"대인관계(부부, 자녀)",해당없음,기쁨,느긋,HAPPY,같은 아파트에 사는 친구랑 쇼핑하러 갔는데 둘이서 성격이 정반대다 보니까 쇼핑하는 게 쉽지가 않았어. 나는 성격이 좀 급한 편이고 친구는 느긋한 성격이다 보니 쇼핑하는 데 시간이 너무 오래 걸렸어. 정말 답답하더라. 그 친구랑 뭘 같이 하더라도 나는 조급해 보이고 그 친구는 느릿느릿한 게 답답해서 죽겠어.,Pro_08637,Pro_08637_00001,E66,S07_D02,HAPPY,False,missing-fatigue-keyword
train-032493,train,청년,남성,"진로,취업,직장",해당없음,상처,괴로워하는,SAD,몇 년을 노력했는데 요즘 취업에 낙방해서 괴로워. 열심히 준비한 시험이 계속 좌절하는 걸 보니 힘이 안 나. 올해는 내가 할 수 있는 건 다 해보고 내년에 더 힘내보려고.,Pro_03819,Pro_03819_00013,E48,S06_D02,SAD,False,missing-fatigue-keyword
train-040108,train,노년,남성,"건강,죽음",만성질환 무,당황,외로운,SAD,이 일도 언제까지 할 수 있을지 모르겠어. 맞아. 요즘에 일도 깜박깜박하고 기억이 잘 안 나고 몸도 힘들고 걱정이야. 어. 혹시 치매라도 올까 봐 무서워.,Pro_10664,Pro_10664_00050,E53,S11_D02,SAD,False,missing-fatigue-keyword
train-019322,train,청년,남성,"연애,결혼,출산",해당없음,당황,당황,ANXIOUS,지금 갑자기 경찰서에서 연락이 왔는데 내 여자 친구가 거기 있대. 이게 무슨 일이야. 맞은 게 아니라 때려서 와있다는데 이런 면이 있었구나. 일단 잘 합의하고 데려와야지.,Pro_03701,Pro_03701_00013,E50,S05_D02,ANXIOUS,False,missing-fatigue-keyword
train-021576,train,청소년,여성,가족관계,해당없음,기쁨,느긋,TIRED,시험도 끝났겠다 늦잠 자도 된다고 허락도 받았겠다 이제 실컷 자야지. 정말 행복해. 응. 시험기간에는 공부하느라 매일매일이 피곤했는데 당분간은 실컷 잘 수 있어서 좋아. 응. 공부해야 해서 밤새는 날도 많았고 그래서 잘 수 있는 지금이 너무 좋아.,Pro_01677,Pro_01677_00002,E66,S01_D02,HAPPY,True,fatigue+physical-context
train-006626,train,청년,남성,"연애,결혼,출산",해당없음,기쁨,기쁨,HAPPY,나 여자친구 생겼어. 간호사야. 병원에서 일하지. 그런 여자친구가 생겨서 너무 행복해.,Pro_03711,Pro_03711_00004,E60,S05_D02,HAPPY,False,missing-fatigue-keyword
train-020529,train,노년,여성,대인관계,만성질환 무,분노,방어적인,ANGRY,늘그막에 남편이 또 노름하고 있기에 오늘은 그냥 내버려 두었어. 한 번도 집안일을 돕지는 않으면서 저렇게 돈을 쓰고 다니니 화가 나지. 그럴까? 이 나이 먹고 이혼하기는 그렇고.,Pro_11345,Pro_11345_00006,E14,S04_D02,ANGRY,False,missing-fatigue-keyword
train-009417,train,중년,여성,"재정,은퇴,노후준비",해당없음,당황,당황,ANXIOUS,아직 나이도 오십인데 회사에서 나가라고 해서 순간 너무 황당했어. 육십도 안되었는데 너무 빨리 나가라고 하니깐 순간 멍해지는 느낌이야. 그래도 경력이 있으니깐 직장은 구해질 거야 걱정 안 해.,Pro_08741,Pro_08741_00020,E50,S08_D02,ANXIOUS,False,missing-fatigue-keyword
train-007330,train,청년,여성,"진로,취업,직장",해당없음,불안,걱정스러운,ANXIOUS,내 친구가 오늘 취직했대. 나도 회사 다니고 싶어. 응. 다음 주에 면접 보러 가. 응. 면접에서 말하는 연습을 하고 있어.,Pro_05368,Pro_05368_00015,E37,S06_D02,ANXIOUS,False,missing-fatigue-keyword
train-039171,train,노년,여성,대인관계,만성질환 무,슬픔,환멸을 느끼는,ANGRY,요양병원에서 봉사하는 날이 기다려져. 나를 기다리는 할머니가 계셔. 자식과 떨어져 지내는 것을 슬퍼하시더라. 얘기를 잘 들어드려 그런가 할머니께서 어찌나 나를 찾으시는지 두고 올 때는 마음이 아플 지경이야.,Pro_11360,Pro_11360_00031,E29,S04_D02,ANGRY,False,missing-fatigue-keyword
train-007127,train,청년,여성,대인관계,해당없음,슬픔,슬픔,SAD,오늘 회사 동료가 퇴사했어. 서로 의지했었는데 앞으로 자주 못 본다고 생각하니 아쉬워.,Pro_05111,Pro_05111_00029,E20,S04_D02,SAD,False,missing-fatigue-keyword
train-004066,train,청년,남성,"진로,취업,직장",해당없음,기쁨,신뢰하는,CALM,대학을 졸업했는데. 전공과목에 맞춰서 진로를 정해 직장을 구하기가 힘들어. 흔하지 않은 과목이라서 자리가 잘 안나.,Pro_03833,Pro_03833_00015,E62,S06_D02,CALM,False,missing-fatigue-keyword
train-034253,train,청년,남성,"진로,취업,직장",해당없음,분노,분노,ANGRY,직장 동료들에게 성 정체성을 이야기하니까 나를 벌레 취급했어. 직장 동료들이 나의 성 정체성을 이해해 주면 좋겠는데 어떻게 해야 할지 고민이야. 회사에서는 최대한 사적인 부분에 대해서는 말을 아끼는 것이 좋을 것 같아.,Pro_03781,Pro_03781_00037,E10,S06_D02,ANGRY,False,missing-fatigue-keyword
train-026102,train,중년,여성,"직장, 업무 스트레스",해당없음,슬픔,우울한,TIRED,요즘 너무 지치고 힘들다. 우리 직장에서 내가 제일 힘든 일을 하는 것 같아 젊은이들이랑 생각도 안 맞아서 업무 분담이 힘드네. 뭐라고 말 하면 지적하는 사람이 될 것 같고.,Pro_08955,Pro_08955_00011,E24,S10_D02,SAD,True,fatigue+physical-context
train-030860,train,청년,남성,대인관계,해당없음,기쁨,편안한,CALM,요즘 나는 너무 편안해. 대인관계가 원만해서 그런가봐.,Pro_03594,Pro_03594_00016,E63,S04_D02,CALM,False,missing-fatigue-keyword
train-029193,train,노년,여성,재정,만성질환 무,기쁨,만족스러운,HAPPY,내가 건강해서 경제활동을 할수 있다는것이 너무 다행이야. 자식들한테 손벌리지 않아서 마음이 편해.,Pro_12475,Pro_12475_00005,E64,S13_D02,HAPPY,False,missing-fatigue-keyword
train-013860,train,청년,여성,대인관계,해당없음,기쁨,편안한,CALM,진정한 친구란 잘못한 일에 대해 따끔하게 충고를 할 수 있어야 한다고 생각해. 아냐. 그저 진정한 친구란 내가 무언가 잘못을 했을 때 따끔한 충고를 아끼지 말아야 한다는 거야. 딱 한 사람 있어. 나는 그를 진정한 친구라고 생각하고 있어.,Pro_05154,Pro_05154_00033,E63,S04_D02,CALM,False,missing-fatigue-keyword
train-023958,train,중년,여성,"직장, 업무 스트레스",해당없음,기쁨,안도,CALM,직장에서 맡은 이 직무가 나랑 잘 맞아서 정말 다행이야. 나랑 안 맞는 직무를 맡았을 땐 스트레스가 컸는데 이번에는 그러지 않아서 기뻐. 오래간만에 친구들을 만나서 수다라도 떨어야겠어.,Pro_08998,Pro_08998_00020,E67,S10_D02,CALM,False,missing-fatigue-keyword
train-031696,train,중년,남성,"직장, 업무 스트레스",해당없음,분노,툴툴대는,TIRED,요즘 직장에서 업무 스트레스로 피곤하네. 직원 몇명이 그만 둬서 그 업무가 나한테 왔지.,Pro_07382,Pro_07382_00005,E11,S10_D02,ANGRY,True,fatigue+physical-context
train-036682,train,청소년,남성,학업 및 진로,해당없음,기쁨,흥분,HAPPY,오래전부터 진학하고 싶었던 대학에 합격을 했어. 진짜 공부하고 싶었던 대학이라서 속히 가고 싶어. 일단 꿈에 그리던 대학교 삶이랑 더 전문적인 공부를 하고 싶어.,Pro_00236,Pro_00236_00011,E65,S02_D02,HAPPY,False,missing-fatigue-keyword
train-027069,train,청소년,남성,학업 및 진로,해당없음,당황,열등감,SAD,친구가 나보다 성적이 잘 나왔는데 나도 모르게 내가 더 성적이 높다고 거짓말 했어. 내가 왜 그랬는지 모르겠어. 당황스러워. 사실대로 말했어. 마음이 편해지더라고. 이번에도 그래야겠다.,Pro_00225,Pro_00225_00035,E54,S02_D02,SAD,False,missing-fatigue-keyword
train-021964,train,청년,남성,대인관계,해당없음,기쁨,기쁨,TIRED,피곤한 업무를 마치고 집에 돌아오면 간단하게 술잔을 기울여줄 친구가 있어 좋아. 이럴 땐 친구를 정말 잘 사귀었다는 생각이 들어. 오늘 친구한테 고마운 마음을 담아서 선물을 줄 거야!,Pro_03591,Pro_03591_00027,E60,S04_D02,HAPPY,True,fatigue+physical-context
train-027865,train,중년,남성,"대인관계(부부, 자녀)",해당없음,기쁨,흥분,HAPPY,오늘 내 첫째 딸 대학 합격 발표날이야. 나도 덩달아 긴장되는데 내색도 못하고 있어. 딸이 지금 엄청 긴장하고 있어. 떨어질까 봐 걱정이 많이 되나 봐. 핫초코라도 타서 가져다 줘야겠어. 조금만 기다리면 되니까 옆에서 관심을 좀 돌려야지.,Pro_07076,Pro_07076_00005,E65,S07_D02,HAPPY,False,missing-fatigue-keyword
train-048841,train,중년,여성,"재정,은퇴,노후준비",해당없음,당황,고립된,SAD,몸도 불편한데 남들보다 열심히 일해도 벌어들이는 돈은 조금밖에 안 되니 살기가 너무 힘들어. 이렇게 태어난 게 마치 벌 받는 것 같고 나 때문에 가족들까지 힘들어하니 미안할 따름이야. 최선을 다하면 언젠가는 좋은 날이 올 거라고 믿고 더욱 열심히 할 거야.,Pro_08742,Pro_08742_00015,E51,S08_D02,SAD,False,missing-fatigue-keyword
train-007372,train,청년,여성,대인관계,해당없음,기쁨,기쁨,HAPPY,제일 친한 친구가 결혼하게 돼서 기쁘다! 친구와 결혼할 사람이 착한 사람이라서 좋아.,Pro_05151,Pro_05151_00030,E60,S04_D02,HAPPY,False,missing-fatigue-keyword
train-028637,train,청년,여성,대인관계,해당없음,기쁨,신뢰하는,CALM,오늘 십 년 지기 친구들과 만나서 신나게 놀기로 했어. 십 년 동안 거의 싸운 일이 없어. 서로의 이야기를 들어주고 존중해 주다 보니 이렇게 계속 친하게 지낼 수 있었던 것 같아.,Pro_05153,Pro_05153_00020,E62,S04_D02,CALM,False,missing-fatigue-keyword
train-012259,train,청년,여성,"연애,결혼,출산",해당없음,기쁨,신이 난,HAPPY,좋아하던 선배에게 어제 고백을 받았어! 응. 내일 함께 영화를 보러 갈 거야. 그러게 한 번 생각해 봐야겠다.,Pro_05279,Pro_05279_00036,E68,S05_D02,HAPPY,False,missing-fatigue-keyword
train-031698,train,중년,여성,"직장, 업무 스트레스",해당없음,슬픔,환멸을 느끼는,ANGRY,회사를 빨리 그만두든가 해야지. 사람 사는 꼴이 말이 아니야. 항상 이런 식이야. 상사도 업무도 문제가 끊이질 않아.,Pro_08960,Pro_08960_00018,E29,S10_D02,ANGRY,False,missing-fatigue-keyword
train-029545,train,중년,남성,"직장, 업무 스트레스",해당없음,분노,방어적인,TIRED,어제 일이 너무 많아서 야근을 했지 뭐야! 피곤해 조금 쉬고 싶어. 직장 업무 스트레스로 이러다 쓰러지지나 않을지 모르겠어.,Pro_07385,Pro_07385_00011,E14,S10_D02,ANGRY,True,fatigue+physical-context
train-033298,train,중년,남성,건강,해당없음,슬픔,눈물이 나는,TIRED,몸이 예전 같지 않고 너무 피곤하고 힘들어. 운동을 해보고 싶긴 하지만 귀찮아,Pro_07278,Pro_07278_00009,E27,S09_D02,SAD,True,fatigue+physical-context
train-024913,train,노년,남성,재정,만성질환 무,당황,부끄러운,ANXIOUS,얼마 전에 지갑을 잃어버려서 지갑이랑 카드 그리고 돈 모두 잃어버렸어. 이 나이 먹고 물건을 잃어버리다니. 너무 부끄러워. 일단 지갑을 먼저 찾고 다음에는 꼭 주머니에 넣고 다녀야겠어.,Pro_10907,Pro_10907_00027,E56,S13_D02,ANXIOUS,False,missing-fatigue-keyword
train-002552,train,중년,남성,"직장, 업무 스트레스",해당없음,분노,노여워하는,ANGRY,회사에서 무슨 생각으로 이런 신입을 뽑은 건지 모르겠어. 지금이라도 당장 회사 그만두게 하고 싶어! 그 친구는 상사한테 대들고 일도 안 해. 어떻게 해야 할지 정말 고민돼. 너무 화가 나서 그 친구에게 직접 얘기를 해야겠어.,Pro_07389,Pro_07389_00025,E18,S10_D02,ANGRY,False,missing-fatigue-keyword
train-030625,train,청소년,여성,가족관계,해당없음,슬픔,실망한,SAD,누나한테 실망했어 누나가 이번에 나쁜 친구들을 사귀었나봐. 항상 똑바른 길로만 다니는 줄 알았는데 너무 실망이야.,Pro_01632,Pro_01632_00011,E21,S01_D02,SAD,False,missing-fatigue-keyword
train-003981,train,청년,여성,대인관계,해당없음,분노,툴툴대는,TIRED,오늘도 과장님이 회식하자고 해서 늦게 마쳤어. 정말 피곤해. 업무의 연장이잖아. 난 정시에 퇴근하고 싶은데 너무 자주 회식을 해야 해. 회식할 땐 또 잔소리 듣고 너무 힘들어.,Pro_05102,Pro_05102_00027,E11,S04_D02,ANGRY,True,fatigue+physical-context
train-004211,train,중년,여성,"직장, 업무 스트레스",해당없음,분노,좌절한,TIRED,즘 회사에서 컴퓨터로 하는 업무가 많아져서 힘들어. 컴퓨터를 잘 다루지 못해서 업무가 늦게 처리하니 퇴근도 늦어지고 피곤해.,Pro_08943,Pro_08943_00022,E12,S10_D02,SAD,True,fatigue+physical-context
train-034902,train,노년,여성,대인관계,만성질환 무,상처,고립된,SAD,나는 그런 사람이 아닌데 마을 사람들이 나를 괴팍한 할머니로 생각해 상처 입었어. 안 그래도 혼자 지내면서 외로운데 그런 오해까지 받아 슬프네. 최대한 긍정적으로 행동하고 건강하게 살아야겠어.,Pro_11374,Pro_11374_00005,E43,S04_D02,SAD,False,missing-fatigue-keyword
train-003082,train,중년,남성,"재정,은퇴,노후준비",해당없음,당황,혼란스러운,ANXIOUS,노후준비를 어떻게 할지 혼란스러워. 그걸 잘 몰라서 한번 검색해봐야겠어.,Pro_07190,Pro_07190_00002,E59,S08_D02,ANXIOUS,False,missing-fatigue-keyword
train-027805,train,노년,남성,대인관계,만성질환 유,불안,당혹스러운,ANXIOUS,무릎 관절 수술을 받고 아들과 함께 집에 왔는데 목발이 없어졌어. 분명 차에 목발을 실었는데 어디로 간 걸까. 나중에 아들에게 부탁해서 차 시트 밑에 확인해달라고 해야겠어.,Pro_09746,Pro_09746_00007,E35,S04_D01,ANXIOUS,False,missing-fatigue-keyword
train-032991,train,청년,여성,"진로,취업,직장",해당없음,불안,스트레스 받는,ANXIOUS,업무가 너무 많아서 스트레스 받아. 사장님도 아실 거야. 직원들이 거의 매일 야근하고 몇 달마다 그만 두는데 모를 수가 없어.,Pro_05363,Pro_05363_00017,E32,S06_D02,ANXIOUS,False,missing-fatigue-keyword
train-033335,train,청년,여성,"연애,결혼,출산",해당없음,당황,고립된,SAD,친구 중에 유일하게 나만 결혼한 아기 엄마야. 그런데 친구들이 내가 아기 엄마라서 날 빼놓고 모여 놀았대. 그렇다고 모임 일정조차 나에게 숨기다니 정말 낙심했어. 아기를 두고 놀러 나갈 순 없으니까 동네 맘카페 친구들이라도 만나 육아 정보도 공유하고 수다라도 떨어야겠어.,Pro_05262,Pro_05262_00051,E51,S05_D02,SAD,False,missing-fatigue-keyword
train-003911,train,청년,여성,"진로,취업,직장",해당없음,슬픔,마비된,TIRED,며칠 동안 고생해서 작업했던 파일이 에러가 나면서 사라졌어. 복구가 가능하지 않을 수도 있어. 한순간 멍해지더라. 한순간 다 사라지다 보니 현실감이 없었어. 온몸이 마비된 것 같은 착각에 들기도 했고. 미치겠더라고. 지금은 상황을 인정하고 스스로 다독이는 중이야. 그리고 매 순간 후회하지 않으려 해. 결국 힘들고 지치는 건 나니까.,Pro_05356,Pro_05356_00007,E25,S06_D02,SAD,True,fatigue+physical-context
train-034822,train,노년,남성,"건강,죽음",만성질환 무,불안,스트레스 받는,ANXIOUS,아내가 죽고 지내는 첫 제사라 나름대로 준비를 많이 했는데 주변에서 참견을 너무 많이 해. 나도 최선을 다해 준비했는데 짜증 나게 왜들 그렇게 참견을 많이 하는지 모르겠어. 속상하니 나가서 친구들과 술 한잔하고 와야겠어.,Pro_10643,Pro_10643_00011,E32,S11_D02,ANXIOUS,False,missing-fatigue-keyword
train-006577,train,중년,여성,건강,해당없음,분노,툴툴대는,TIRED,나이를 먹는 게 참으로 서럽네. 예전과 달리 피로 해소도 늦고 잠을 자도 피곤하고 몸이 너무 힘들어. 건강식품 및 영양제를 먹는데도 건강이 안 좋아지는 게 계속 느껴져.,Pro_08822,Pro_08822_00009,E11,S09_D02,ANGRY,True,fatigue+physical-context
train-035851,train,청소년,남성,학업 및 진로,해당없음,슬픔,눈물이 나는,TIRED,열심히 공부를 했는데도 성적이 안올라. 이러다가 내가 하고 싶은 일을 할 수 없을것 같아서 너무 괴로워. 고마워. 우선 너무 피곤하니 잠부터 자고 싶어.,Pro_00198,Pro_00198_00022,E27,S02_D02,SAD,True,fatigue+physical-context
train-045592,train,청소년,남성,가족관계,해당없음,상처,"가난한, 불우한",SAD,나는 엄마밖에 없어서 아빠가 너무 보고 싶어. 가족들끼리 여행 다니는 친구들을 보면 너무 부럽고 내 처지가 너무 불행하게 느껴져. 그래도 엄마에게는 내 마음을 티 내지 않으려고 해. 엄마도 힘드시니까.,Pro_00096,Pro_00096_00003,E45,S01_D02,SAD,False,missing-fatigue-keyword
train-037973,train,노년,여성,대인관계,만성질환 유,당황,외로운,SAD,오늘 병원에 가서 혈관 검사를 하느라 엠알아이를 찍었어. 아침 일찍부터 서둘렀지. 폐소공포증이 있어 검사 받을 때 겁이 나고 식은땀이 나. 기계에 들어갈 때 눈을 꼭 감고 끝나기만 기다리는 편이야. 보호자를 옆에 두고 검사받으면 좋겠지만 방사선량이 커서 그러지도 못하고 꾹 참느라 힘들었어.,Pro_11324,Pro_11324_00030,E53,S04_D01,SAD,False,missing-fatigue-keyword
train-033206,train,청년,남성,"진로,취업,직장",해당없음,슬픔,슬픔,SAD,앞으로의 진로가 걱정돼. 회사 일에도 집중을 못 하겠어. 앞으로 어떻게 해야 할까?,Pro_03791,Pro_03791_00021,E20,S06_D02,SAD,False,missing-fatigue-keyword
train-028920,train,청년,남성,대인관계,해당없음,분노,안달하는,ANXIOUS,좋아하는 사람이 생겨서 친해지고 싶은데 그 사람은 이미 친한 남자들이 많은 것 같아. 어떡할지 모르겠는데 마음만 조급해져. 아니. 잘 모르겠어. 아무래도 관심사를 파악하고 더 친해지려고 노력해야겠어.,Pro_03547,Pro_03547_00019,E16,S04_D02,ANXIOUS,False,missing-fatigue-keyword
train-006160,train,중년,남성,"재정,은퇴,노후준비",해당없음,기쁨,편안한,CALM,이제 퇴직이 얼마 남지 않아 많이 편안해졌어. 쉼 없이 달려온 것 같아. 이제 나를 위한 시간을 보내고 싶어.,Pro_07194,Pro_07194_00009,E63,S08_D02,CALM,False,missing-fatigue-keyword
train-029172,train,청소년,여성,가족관계,해당없음,기쁨,감사하는,HAPPY,아버지가 병이 낫게 되어 퇴원하실 수 있게 되어서 너무 감사해. 다시는 아프시지 않게 곁에서 잘 보살펴 드릴꺼야.,Pro_01672,Pro_01672_00008,E61,S01_D02,HAPPY,False,missing-fatigue-keyword
train-018822,train,청소년,여성,학업 및 진로,해당없음,불안,회의적인,ANXIOUS,우리들을 대학에 가게 한 건 학교지 우리 자신이 아니야. 우리는 학교의 노예 같아. 우리가 꿈을 꿀 시간은 주지 않고 무조건 좋은 대학에 가도록 유도했어. 정말 너무해. 내가 스스로 내 시간을 확보하겠어. 학교가 바라는 대로가 아닌 내 진로는 내가 결정해!,Pro_01767,Pro_01767_00038,E36,S02_D02,ANXIOUS,False,missing-fatigue-keyword
train-007525,train,중년,여성,"직장, 업무 스트레스",해당없음,분노,툴툴대는,ANGRY,사장님이 자꾸 기존 업무 외에 급한 일이라며 다른 일까지 처리해달라고 해서 짜증 나. 한 두 번이면 모르겠는데 반복되다 보니 매번 퇴근 시간도 늦어져서 문제네. 아무래도 사장님께 업무 외 일은 시키지 말아 달라고 말씀을 드려야겠어.,Pro_08942,Pro_08942_00009,E11,S10_D02,ANGRY,False,missing-fatigue-keyword
train-041196,train,노년,여성,재정,만성질환 무,분노,안달하는,ANXIOUS,아무리 회사 다닐 때 중역이라고 해도 자신을 인정 못 하고 있는 모습을 보면 속이 상해. 남편 말이지. 과거를 잊어버리고 현실에 맞게 앞을 내다보는 미래가 보여야 할 텐데. 할 일도 없고 받아주는 데도 없으니 현실이 너무 안타까워.,Pro_12427,Pro_12427_00019,E16,S13_D02,ANXIOUS,False,missing-fatigue-keyword
train-025210,train,노년,여성,대인관계,만성질환 유,슬픔,실망한,SAD,어릴 적 한 약속으로 동창들과 여행을 가기로 했는데 관절염이 심해져서 나만 빠지게 되었어. 너무 실망스러워. 동창들도 실망한 나를 보고 걱정이 됐나 봐. 다들 슬퍼해. 슬프지만 내가 먼저 잘 다녀오라고 하는 게 좋을 거 같아.,Pro_11292,Pro_11292_00008,E21,S04_D01,SAD,False,missing-fatigue-keyword
