sample_id,split,age_group,gender,situation_keyword,physical_disease,emotion_major,emotion_minor,service_label,text,persona_id,talk_id,emotion_code,situation_code,relabel_reason
train-010358,train,청년,여성,"연애,결혼,출산",해당없음,분노,툴툴대는,ANGRY,남자 친구가 데이트 중에도 자꾸 휴대전화 게임만 해. 일주일에 한두 번 만나는 게 전부인데. 응. 얘기했는데도 같이 한 공간에 있는 거면 충분한 거라고 오히려 나를 이해 못 해. 응. 소풍도 가고 싶고 영화도 보고 싶다고 이야기는 했지만 안 통해. 결국 내가 포기했어.,Pro_05222,Pro_05222_00005,E11,S05_D02,
train-042559,train,노년,여성,"건강,죽음",만성질환 유,당황,외로운,ANXIOUS,남편이 큰 병에 걸렸어. 내가 그동안 남편에게 너무 무심했나 봐. 병이 점점 심해질까 무섭고 내가 자기한테 무심했다고 원망할까 봐 두려워. 남편한테 잘 할 거야. 병에 좋은 음식도 찾아보고 간호도 할 거야.,Pro_12164,Pro_12164_00011,E53,S11_D01,SAD_TO_ANXIOUS_BY_MAJOR
train-016906,train,중년,남성,건강,해당없음,불안,걱정스러운,ANXIOUS,내가 암에 걸렸다고 하더군. 더 자세한 검사를 위해 입원하라는데 아내와 아이에게 어떻게 말해야 할지 모르겠어. 어서 치료를 시작해야 예후가 좋을 텐데 마음이 급해지네. 가족에게 어서 털어놓고 의사와 병원의 지시에 따라 치료에 전념해야겠어.,Pro_07288,Pro_07288_00017,E37,S09_D02,
train-023760,train,중년,여성,건강,해당없음,기쁨,신뢰하는,CALM,나의 아픔을 공감해주는 남편을 믿어서 정말로 기뻐. 나의 이야기를 하면 마치 자신이 겪은 것처럼 공감해줘서 너무 기뻐. 남편과 더 이야기하고 나도 공감을 해줘야겠어.,Pro_08873,Pro_08873_00004,E62,S09_D02,
train-006465,train,청년,남성,대인관계,해당없음,상처,고립된,SAD,친구들끼리 싸웠는데 너무 난감해졌어. 나만 고립되고 친구들끼리 하나 되어서 싸움을 했어. 내일 친구들하고 다시 얘기해봐야겠어.,Pro_03574,Pro_03574_00017,E43,S04_D02,
train-041364,train,노년,남성,재정,만성질환 무,분노,툴툴대는,ANGRY,현재의 내 모습이 정말 실망스럽다. 한때는 잘나가는 대기업에서 부장으로까지 있었는데 이제는 전단지 돌리는 신세라니 말이야. 어딜 가도 하대받는 느낌이야.,Pro_10862,Pro_10862_00035,E11,S13_D02,
train-002413,train,청년,여성,"연애,결혼,출산",해당없음,기쁨,기쁨,HAPPY,나 어제 남자친구한테 프러포즈 받았어. 말로 표현할 수 없을 정도로 기뻐. 내년 봄에 결혼식을 할 예정이라서 이제부터 준비하려고 해.,Pro_05271,Pro_05271_00015,E60,S05_D02,
train-035936,train,청소년,남성,학교폭력/따돌림,해당없음,기쁨,안도,CALM,금일 학교에서 학교폭력이 있었는데 선생님이 그 장면을 목격해서 다행이야. 선생님이 잘 푸실거야 그동무도 이젠 편하게 생활 할 수 있을거야.,Pro_00358,Pro_00358_00002,E67,S03_D02,
train-022642,train,청년,여성,"진로,취업,직장",해당없음,당황,열등감,ANXIOUS,동기가 승진을 하면서 회사 다니는 동안 내 연봉이 오르지 않을 것 같아서 열등감 느껴. 다른 사람들도 나를 안쓰럽게 생각하는 것 같아서 당황스러워. 친한 동료를 만나서 하소연해봐야겠어.,Pro_05385,Pro_05385_00027,E54,S06_D02,SAD_TO_ANXIOUS_BY_MAJOR
train-029995,train,청소년,남성,가족관계,해당없음,상처,상처,SAD,엄마가 형만 챙기고 예뻐하는 것 같아. 응. 너무 서운해.,Pro_00091,Pro_00091_00017,E40,S01_D02,
train-027926,train,노년,여성,재정,만성질환 유,기쁨,편안한,CALM,병원 간호도 해주고 병원비를 책임져주는 남편이 있어 항상 든든해. 고생하는 남편을 위해 선물을 하고 싶어. 퇴원하고 남편과 편안하게 해외 여행을 해야겠어.,Pro_12414,Pro_12414_00002,E63,S13_D01,
train-019498,train,노년,남성,대인관계,만성질환 유,분노,좌절한,ANGRY,허리 수술을 받았던 곳이 또 터져서 재수술을 해야 한다고 해서 화가 났어. 수술을 어떻게 했길래 재수술을 해야 하는 거야. 다른 병원에도 가봐야겠어.,Pro_09723,Pro_09723_00013,E12,S04_D01,SAD_TO_ANGRY_BY_MAJOR
train-023765,train,중년,여성,건강,해당없음,기쁨,신뢰하는,CALM,유기농 채소와 곡물로 요리를 해 먹으면 건강해질 거야. 얼마나 좋아질지 기대돼. 요새 건강에 관심이 많아졌었는데 건강식을 해먹을 방법을 찾아서 기분이 좋아. 건강을 위한 다른 방법이 더 있나 찾아봐야겠어. 몸이 건강해지면 더 행복해질 거야.,Pro_08873,Pro_08873_00015,E62,S09_D02,
train-007777,train,중년,여성,"직장, 업무 스트레스",해당없음,분노,짜증내는,ANGRY,직장에서의 업무가 너무 많아서 짜증이 나. 한 가지를 소화하면 또 다른 한 가지를 시켜서 짜증 나. 나만 그리 느끼는 걸까?,Pro_08944,Pro_08944_00034,E13,S10_D02,
train-024400,train,노년,남성,"건강,죽음",만성질환 무,불안,두려운,ANXIOUS,살이 계속 쪄서 너무 걱정돼. 나잇살이라 그런지 살이 쉽게 빠지지가 않아. 운동보다는 식단을 조절해 봐야겠어.,Pro_10642,Pro_10642_00007,E31,S11_D02,
train-035385,train,노년,여성,재정,만성질환 무,기쁨,편안한,CALM,다시 취업해서 안정적인 수입이 생겼어. 기뻐. 수입을 모아서 뭘 해야 할지 고민이야. 친구들하고 해외여행을 가야겠어.,Pro_12474,Pro_12474_00004,E63,S13_D02,
train-015959,train,중년,여성,"대인관계(부부, 자녀)",해당없음,상처,배신당한,SAD,아들이 학원비를 놀러 다니는데 썼대. 하라는 공부는 안하고 거짓말까지 했다는 게 너무 실망스러워. 아들이 왜 그런 행동을 했는지 물어봐야겠어.,Pro_08613,Pro_08613_00027,E42,S07_D02,
train-034013,train,청소년,남성,학교폭력/따돌림,해당없음,분노,짜증내는,ANGRY,요즘 날 괴롭히는 애들이 없어졌으면 좋겠다는 생각이 들어. 그야 날 괴롭히니까. 내가 할 수 있는 게 그것밖에 더 있겠어? 나도 잘 모르겠네. 복싱이나 다닐까?,Pro_00304,Pro_00304_00015,E13,S03_D02,
train-019810,train,노년,남성,대인관계,만성질환 유,분노,툴툴대는,ANGRY,처남은 매번 왜 저럴까? 내가 병상에 오래 있어서 아내가 고생이라고 하는 게 너무 화가 나. 몇 번 그 말을 듣기는 했는데 들을 때마다 너무 화가 치밀어 올라. 아들한테 전화해서 욕이나 실컷 해야겠어.,Pro_09722,Pro_09722_00005,E11,S04_D01,
train-033781,train,청년,남성,"진로,취업,직장",해당없음,당황,남의 시선을 의식하는,ANXIOUS,프로젝트가 무산돼서 팀원들이 속상해할 것 같아. 많이 준비했었는데 다들 상심이 클 거야. 커피라도 한 잔씩 돌리고 다시 힘내라고 해봐야겠어.,Pro_03823,Pro_03823_00049,E52,S06_D02,
train-023090,train,중년,남성,"직장, 업무 스트레스",해당없음,슬픔,실망한,SAD,일이 잘 되면 회사 덕분이지만 반대의 경우엔 내가 질타를 받아. 요즘 부쩍 일에 흥미도 떨어지고 의욕도 떨어지는 것 같아. 주말에 가족들이랑 야외로 캠핑 가서 바람이나 쐬고 올까 해.,Pro_07392,Pro_07392_00021,E21,S10_D02,
train-036310,train,청소년,남성,가족관계,해당없음,슬픔,낙담한,SAD,오라버니와 사이가 안좋아. 다른 친구들은 오라버니와 친하다던데. 아니 오라버니가 나를 무시하고 화만내서 이야기할 수가 없어. 오빠와의 시간을 만들어봐야겠어. 그동안 나도 소홀했던거 같아.,Pro_00079,Pro_00079_00043,E28,S01_D02,
train-003694,train,중년,여성,건강,해당없음,기쁨,신뢰하는,CALM,얼마 전에 건강검진을 받았는데 의사 선생님께서 별 이상이 없다고 하니 다행이야. 모르겠어. 사람들을 만나서 대화가 잘 통하지 않는 경우가 많아서 혼란스러워. 응. 의사 선생님 말씀이야 믿을 수 있으니까.,Pro_08873,Pro_08873_00009,E62,S09_D02,
train-025316,train,노년,여성,대인관계,만성질환 유,당황,남의 시선을 의식하는,ANXIOUS,항암치료로 인해 머리를 밀어서 사람들 만나기 꺼려져. 사람들이 놀릴까 봐 두려워. 사람들이 신경 쓰여도 모자를 쓰고 나갈래.,Pro_11323,Pro_11323_00015,E52,S04_D01,
train-036104,train,청소년,여성,학교폭력/따돌림,해당없음,기쁨,편안한,CALM,오늘 날 계속 괴롭혀왔던 애들을 학교폭력으로 고소했어. 두려웠는지 바로 사과하고 빌더라. 응. 솔직히 겁이 났는데 그 애들의 태도를 보니까 마음이 편안해졌어. 앞으로 다시 괴롭힘 당하지 않을 거야.,Pro_01914,Pro_01914_00020,E63,S03_D02,
train-048506,train,청소년,여성,가족관계,해당없음,상처,괴로워하는,SAD,아까 엄마가 나한테 아빠랑 그만 연락하라면서 화냈어. 너무 속상해. 너무 속상했어. 그런데 내가 엄마한테 대들어서 너무 후회돼. 엄마에게 미안하다고 하면서 안아주는 것이 좋겠어.,Pro_01659,Pro_01659_00008,E48,S01_D02,
train-021504,train,청소년,여성,가족관계,해당없음,상처,"가난한, 불우한",SAD,엄마는 나에게 해주지 못한 게 많아서 항상 내게 미안하다고 해서 속상해. 충분히 잘해주셨는데 그런 말을 들을 때마다 속상하니까 안 하셨으면 좋겠어. 고마움의 말을 수시로 전해야겠어. 엄마는 지금 나를 위해 최선을 다하고 있음에 말이야.,Pro_01656,Pro_01656_00032,E45,S01_D02,
train-023257,train,중년,남성,"직장, 업무 스트레스",해당없음,기쁨,안도,CALM,회사 신입이 일을 곧잘 해서 다행이야. 업무량이 많아서 걱정했는데 한시름 놨어. 더 잘 적응할 수 있도록 실무교육도 해야지.,Pro_07438,Pro_07438_00020,E67,S10_D02,
train-005378,train,청년,여성,"연애,결혼,출산",해당없음,기쁨,만족스러운,HAPPY,결혼하게 되었어. 올해 말인데 결혼식은 따로 안 하고 가족들이랑 식사만 하기로 했어. 예전부터 보여 주는 식의 결혼식이 싫었어. 마침 주변 사람들도 이해해 줘서 다행이야.,Pro_05275,Pro_05275_00003,E64,S05_D02,
train-027625,train,청년,남성,대인관계,해당없음,분노,악의적인,ANGRY,엄마도 아빠도 내 말을 들어주지 않아. 정말 이 세상에 홀로 있는 기분이야. 이 세상에 내 편은 아무도 없는 것 같아. 앞으로는 절대 그 친구에게 차를 빌려주지 말아야겠어.,Pro_03546,Pro_03546_00022,E15,S04_D02,
train-035274,train,노년,남성,재정,만성질환 무,기쁨,편안한,CALM,내가 모아둔 노후 자금도 있는데 내 자식들이 따로 용돈도 줘. 그래서 행복하게 지내고 있어. 하지만 나에게 용돈 주는 게 자식들에게 부담이 될까 걱정이야. 그것도 나름 자식들의 마음일 거니까 내가 적정한 선의 돈만 용돈으로 받아야겠어.,Pro_10914,Pro_10914_00001,E63,S13_D02,
train-032296,train,중년,남성,건강,해당없음,분노,악의적인,ANGRY,내가 먹으려고 홍삼을 샀더니 마누라가 그거 먹고 얼마나 오래 살려고 하냐고 하더군. 그래서 크게 싸웠어. 본인은 매번 어디가 좋다는 말을 듣는 대로 이것저것 사다 먹으면서 난 처음 해보는데도 저러니 어이가 없더군.,Pro_07266,Pro_07266_00020,E15,S09_D02,
train-002203,train,청소년,여성,학업 및 진로,해당없음,슬픔,후회되는,SAD,간호학과에 가고 싶은데 성적이 안 좋아. 놀지 말고 공부 좀 할 걸 그랬어. 성적에 맞춰서 내가 갈 수 있는 대학을 알아봐야겠어.,Pro_01754,Pro_01754_00001,E23,S02_D02,
train-031649,train,노년,여성,재정,만성질환 유,기쁨,신이 난,HAPPY,드디어 내가 곗돈을 타게 되어서 신이 나. 가족들과 근사한 레스토랑에서 식사를 하고 싶어.,Pro_12419,Pro_12419_00005,E68,S13_D01,
train-017599,train,중년,남성,"재정,은퇴,노후준비",해당없음,기쁨,안도,CALM,자격증이란 게 꽤 매력적이고 재미가 있네. 은퇴하고 할 직업 좀 찾아보다가 그랬지. 자격증이 있으니 마음이 좀 놓이면서 기쁘기도 하네. 이걸로 취직도 할 수 있을 테고. 안심이야.,Pro_07198,Pro_07198_00012,E67,S08_D02,
train-014821,train,청년,남성,"진로,취업,직장",해당없음,기쁨,흥분,HAPPY,해냈어! 드디어 우리 부서가 에이 팀을 이겼어! 매일 야근한 보람이 있었어. 엄청 힘들었는데. 엄청 기뻐. 오늘 저녁은 축하주라도 마셔야겠어!,Pro_03836,Pro_03836_00021,E65,S06_D02,
train-015760,train,청소년,여성,학업 및 진로,해당없음,기쁨,만족스러운,HAPPY,이번 시험에서 공부해서 노력한 만큼 성적이 나와서 만족스러워. 다음 시험에도 노력하면 성적을 잘 받을 수 있을지 걱정스러워. 수업을 열심히 듣고 시험 공부를 전보다 일주일 더 먼저 시작했어.,Pro_01795,Pro_01795_00023,E64,S02_D02,
train-035345,train,청소년,남성,가족관계,해당없음,기쁨,안도,CALM,아빠가 운전을 하다가 교통사고가 날 뻔했어. 사고가 나지 않아서 다행이야. 아빠가 운전 중에 핸드폰을 사용하셨나보더라고. 습관이신 것 같은데 정말 걱정이야. 아빠한테 진지하게 핸드폰을 사용하지 말아 달라고 부탁해야겠어.,Pro_00118,Pro_00118_00009,E67,S01_D02,
train-026634,train,청년,남성,"연애,결혼,출산",해당없음,슬픔,비통한,SAD,이번에 우리 과 친구가 교통사고로 죽었어. 그 친구는 꿈이 컸고 성격도 활발하고 모든 일에 솔선수범이었지. 그런 친구가 목숨을 잃었다고 생각하니 너무 마음이 아프다. 우리 나이에 죽을 거라고 예상한 사람이 얼마나 있겠어? 너무 침통해.,Pro_03673,Pro_03673_00027,E22,S05_D02,
train-005282,train,노년,남성,"건강,죽음",만성질환 무,기쁨,신뢰하는,CALM,국가에서 지원해 주는 여러 노인복지가 많아서 다행이야. 그 덕분에 수입이 없어도 그럭저럭 살아갈 수 있지. 국가에 보호받는 느낌이 들어. 그렇게 말해주니까 으쓱하는걸.,Pro_10673,Pro_10673_00003,E62,S11_D02,
train-019247,train,청년,여성,"진로,취업,직장",해당없음,기쁨,신뢰하는,CALM,선배에게 어떤 고민이든 털어놓을 수 있어서 너무 좋아. 선배는 늘 이성적인 것 같아. 난 감성적이어서 늘 후회를 많이 해. 이성적으로 생각하려는 습관을 들이려고 노력해야 해. 한 순간에 되는 일은 없더라.,Pro_05393,Pro_05393_00013,E62,S06_D02,
train-004894,train,청년,여성,대인관계,해당없음,기쁨,자신하는,HAPPY,오늘 동호회에 처음으로 나가기로 했어. 떨린다! 응. 새로운 사람들을 만나는 게 떨리기도 하고 기대되기도 하네. 맞아! 나는 사람들을 만나서 대화를 나누는 게 즐거워. 새로운 친구를 사귀는 것도 좋고.,Pro_05160,Pro_05160_00013,E69,S04_D02,
train-003072,train,중년,남성,"재정,은퇴,노후준비",해당없음,기쁨,기쁨,HAPPY,기분 좋은 일이 생겼어. 축하해 줘. 로또 일등에 당첨됐어.,Pro_07191,Pro_07191_00001,E60,S08_D02,
train-034243,train,청소년,남성,학업 및 진로,해당없음,기쁨,만족스러운,HAPPY,수학 대회 준비를 열심히 했더니 만족스러운 결과가 나왔어. 다음 대회에서도 좋은 결과를 받을 수 있을까? 다음에도 방심하지 말고 열심히 준비해야겠다.,Pro_00235,Pro_00235_00007,E64,S02_D02,
train-036401,train,청소년,여성,가족관계,해당없음,기쁨,흥분,HAPPY,나에게 열 살 차이가 나는 아우가 있어. 귀엽지. 근데 아우와 같이 다니면 엄마라고 물어봐. 그래도 항상 엄마냐고 물어보니까 짜증나. 내가 그렇게 노안이야?,Pro_01676,Pro_01676_00004,E65,S01_D02,
train-010431,train,중년,여성,"직장, 업무 스트레스",해당없음,기쁨,만족스러운,HAPPY,직장 생활을 하면서 요즘처럼 즐거웠던 적은 없는 것 같아. 묵묵히 직장에 헌신했더니 이제 인정을 받고 대우를 해 줘서 기뻐. 일희일비하지 않고 꾸준하고 성실했던 것이 마침내 이런 만족감을 주는 것 같아.,Pro_08995,Pro_08995_00026,E64,S10_D02,
train-035042,train,노년,여성,대인관계,만성질환 무,상처,희생된,SAD,며느리의 고집으로 요양원에 들어갔어. 내 생각을 고려해주지 않아 상처받았어. 이대로라면 죽을 때까지 요양원에 있을 거 같아서 서글퍼. 딸한테 얘기해서 고향으로 내려가는 것이 가장 좋을 거 같아.,Pro_11377,Pro_11377_00012,E46,S04_D02,
train-004843,train,청년,남성,"진로,취업,직장",해당없음,불안,초조한,ANXIOUS,나 면접 보고 왔는데 어떻게 결과가 나올지 긴장돼. 어려운 질문을 받았는데 말하다가 잘못 말한 것 같아.,Pro_03810,Pro_03810_00006,E39,S06_D02,
train-047662,train,청년,여성,대인관계,해당없음,상처,버려진,SAD,엄마가 언제까지 편의점 알바나 할 거냐고 뭐라고 하시네. 나도 회사에 들어가고 싶어. 내가 대학도 못 나오고 날 받아주는 곳이 없어 너무 힘들어. 계속 취업 못 하면 어떡하지? 돈을 모아서 가게를 하나 시작할까 생각하고 있어.,Pro_05140,Pro_05140_00033,E49,S04_D02,
train-018097,train,청년,여성,"연애,결혼,출산",해당없음,불안,스트레스 받는,ANXIOUS,남편이 육아를 전혀 신경 쓰지 않아. 이제 잔소리하는 거도 지쳐. 같이 낳은 애인데 왜 신경을 하나도 안 쓸까? 생각할수록 너무 스트레스 받는다.,Pro_05243,Pro_05243_00018,E32,S05_D02,
train-051608,train,중년,여성,"대인관계(부부, 자녀)",해당없음,분노,툴툴대는,ANGRY,남편의 장례식을 오늘 끝마쳤어. 이렇게 될 줄 알았다면 내가 더 힘써 보살피는 건데. 바쁘다는 핑계로 아픈 남편을 돌보지 못했어. 모든 게 다 내 탓 같아서 실망스러워. 모르겠어. 너무 갑작스러워서 대책을 세울 틈도 없었어.,Pro_08582,Pro_08582_00011,E11,S07_D02,
train-011725,train,청년,여성,"연애,결혼,출산",해당없음,당황,당황,ANXIOUS,어떡하면 좋지? 생리할 주기가 지나버렸어. 어쩔 줄 모르겠다. 아무래도 병원에 가야겠지? 이런 적이 처음이야. 그래서 놀랐어.,Pro_05261,Pro_05261_00033,E50,S05_D02,
train-019255,train,청소년,여성,가족관계,해당없음,당황,외로운,ANXIOUS,나는 말을 잘 듣고 동생은 사고만 치는데 엄마는 나만 혼내. 너무 외롭고 속상해. 나는 작은 실수를 해도 혼나는데 동생은 봐주니까 서러워서 울고 싶어. 아빠에게 내 생각을 말하고 엄마와 대화할 수 있게 도와달라고 해봐야겠어.,Pro_01664,Pro_01664_00004,E53,S01_D02,SAD_TO_ANXIOUS_BY_MAJOR
train-046597,train,청소년,남성,학업 및 진로,해당없음,상처,희생된,SAD,내가 요즘 게임에 정신이 나가서 엄마한테 자꾸 화를 내게 돼. 왜 이러는지 모르겠어. 게임 하는 도중에 밥 먹으라고 하면 주체할 수 없이 화가 나. 게임에 중독된 것 같아. 한 번 게임을 할 때 한 시간을 넘기지 않도록 자신을 통제해야겠어.,Pro_00217,Pro_00217_00006,E46,S02_D02,
train-043300,train,노년,여성,재정,만성질환 유,슬픔,비통한,SAD,장애가 있어서 지위를 잃게 되면서 경제적으로 어려워졌어. 나한테만 이런 일이 일어난 것 같아 우울한 기분이 들어. 가족들과 얘기해보면서 방법을 찾고 싶어.,Pro_12373,Pro_12373_00027,E22,S13_D01,
train-011117,train,청년,여성,대인관계,해당없음,분노,구역질 나는,ANGRY,내 친구가 내 남자 친구랑 바람을 피웠어. 어떻게 이럴 수가 있지? 놀랐지. 정말 더러운 기분이야. 내가 잘사는 것이 복수라고 생각해. 보란 듯이 잘 살 거야.,Pro_05108,Pro_05108_00006,E17,S04_D02,
train-008388,train,청년,남성,대인관계,해당없음,상처,고립된,SAD,오늘 친구들하고 취업 스터디에 다녀왔는데 속이 답답하다. 스터디는 아무 문제 없는데 애들이 내 의견에 귀를 안 기울여. 처음에 그래도 듣는 척이라도 했는데 이젠 대놓고 무시하는데 벽이 느껴져.,Pro_03574,Pro_03574_00007,E43,S04_D02,
train-015425,train,노년,여성,대인관계,만성질환 무,상처,희생된,SAD,박 노인이 아파서 내가 모든 걸 그만두고 간병하기 시작했어. 내 남은 인생이 희생된 거 같아. 나도 이젠 몸이 따라주지 않는데 어쩌지. 간병인을 고용해야겠어.,Pro_11377,Pro_11377_00015,E46,S04_D02,
train-047759,train,중년,여성,건강,해당없음,상처,억울한,SAD,내 건강 상태가 너무 안 좋아서 앞으로가 걱정되고 불안해. 치료받아도 회복할 거라는 기분이 안 들어. 나한테 시간이 얼마 안 남은 것 같아. 그냥 남편이나 가족들한테 위로받고 싶어.,Pro_08858,Pro_08858_00010,E47,S09_D02,ANGRY_TO_SAD_BY_MAJOR
train-005292,train,노년,남성,"건강,죽음",만성질환 유,기쁨,느긋,HAPPY,사람들은 내 건강에 걱정하면서 안쓰러워하는데 나는 사실 아무렇지도 않아. 전문가가 봐도 그렇게 보이나 보네. 의식해서 그런 생각을 하는 건 아닌데 부정적인 생각을 하지 않는 건 맞는 거 같아.,Pro_10617,Pro_10617_00004,E66,S11_D01,
train-028663,train,청년,여성,대인관계,해당없음,기쁨,자신하는,HAPPY,나 사업을 시작했어. 음식점을 열었어. 내일 개업식을 할 건데 사람들이 엄청 많이 올 거야. 내가 인맥이 굉장히 넓거든.,Pro_05160,Pro_05160_00003,E69,S04_D02,
train-036890,train,청소년,남성,학교폭력/따돌림,해당없음,슬픔,슬픔,SAD,나 요즘 너무 힘들다. 오늘도 학교에서 선배들에게 금전을 빼았겼어. 내일 학교 선생님께 전해드려야 할 것 같아.,Pro_00311,Pro_00311_00002,E20,S03_D02,
train-009317,train,중년,여성,"직장, 업무 스트레스",해당없음,불안,초조한,ANXIOUS,가게에 도둑이 들어서 경찰을 불렀는데 아직 안 와서 불안해. 부른 지 오 분이 지나도 오질 않고 도둑은 계속 협박을 하고 있어. 다행히 경찰차 소리에 도둑이 가버렸어. 얼마나 다행이던지.,Pro_08970,Pro_08970_00001,E39,S10_D02,
train-011474,train,중년,여성,건강,해당없음,기쁨,안도,CALM,나 건강검진 결과 드디어 나왔어! 다행히 다 정상이야! 요즘 소화가 잘 안 돼서 걱정했는데 안심이 되네.,Pro_08878,Pro_08878_00004,E67,S09_D02,
train-011962,train,청년,여성,대인관계,해당없음,분노,노여워하는,ANGRY,제일 친했던 친구가 뒤에서 내 욕을 하는 걸 들었어. 어떻게 그럴 수 있지? 제일 친한 친구라고 생각했는데. 일단 아무 말도 안 했어. 손이 다 떨린다.,Pro_05109,Pro_05109_00055,E18,S04_D02,
train-007546,train,청년,여성,대인관계,해당없음,상처,"가난한, 불우한",SAD,우리 부서 사람들은 다 명품백 하나씩 들고 있더라. 나는 학자금 대출에 생활비에 허덕이고 있는데 참 서럽다. 아직은 월급을 받아도 내야 할 돈들이 아직 많아. 나는 하고 싶은 게 많은데! 빚 다 갚으면 그땐 정말 내가 사고 싶은 걸 사겠어. 나도 명품 가방 하나 사야지.,Pro_05136,Pro_05136_00030,E45,S04_D02,
train-040048,train,노년,남성,대인관계,만성질환 무,불안,조심스러운,ANXIOUS,요즘 전염병이 옮을까 봐 걱정돼서 거의 집에만 있어. 어쩔 수 없지. 요즘 집에서 혼자 할 수 있는 취미생활도 유행한다고 해서 알아봤는데 영 재미없어 보이더라. 응. 그런데 지금은 나가지를 못하니까 인간관계가 좁아지고 혼자 하는 활동엔 흥미도 없어지고 그렇네.,Pro_09809,Pro_09809_00029,E38,S04_D02,
train-033846,train,청년,남성,"진로,취업,직장",해당없음,기쁨,감사하는,HAPPY,내가 구직으로 고민이 많은데 내 친구가 자기네 회사에서 난 구인 광고를 알려줬어. 회사가 거리도 가깝고 친구의 도움도 받을 수 있고 내 성향과 딱 맞는 곳인 것 같아. 응. 그래서 지금 기분이 정말 좋아.,Pro_03832,Pro_03832_00010,E61,S06_D02,
train-020727,train,청년,남성,대인관계,해당없음,분노,분노,ANGRY,내가 하는 말을 아무도 안 믿어줘서 분통해. 심지어 얼마 지나서 내 말이 맞다는 게 밝혀졌는데도 사람들은 내색조차 안 해. 다음에도 똑같은 일이 일어나면 그 친구들과는 연을 끊겠어.,Pro_03541,Pro_03541_00007,E10,S04_D02,
train-031879,train,중년,남성,"대인관계(부부, 자녀)",해당없음,기쁨,편안한,CALM,아이들이 참 잘 컸어. 주말에 집에 있으면 아이들이 설거지하더라고. 그래. 자식 교육을 잘 시켜놨더니 아내 고생을 안시키네.,Pro_07074,Pro_07074_00015,E63,S07_D02,
train-032752,train,노년,여성,대인관계,만성질환 무,분노,성가신,ANGRY,친구가 거의 매일 나에게 카톡으로 풍경 사진이나 동영상을 보내는데 성가시고 가끔 짜증도 나. 친구가 마음 상하지 않게 내 의사를 전달할 방법을 찾아봐야겠어.,Pro_11350,Pro_11350_00034,E19,S04_D02,
