sample_id,split,age_group,gender,situation_keyword,physical_disease,emotion_major,emotion_minor,service_label,text,persona_id,talk_id,emotion_code,situation_code,relabel_reason
train-007293,train,청년,여성,"진로,취업,직장",해당없음,분노,악의적인,ANGRY,부모님께 취업 준비라는 명목으로 경제적 지원을 받고 있는데 사실 그건 거짓말이야. 명품 가방이 너무 예뻐 보여서 그걸 사려고 거짓말을 했거든. 남들이 무시하지 못하잖아.,Pro_05346,Pro_05346_00018,E15,S06_D02,
train-035500,train,청소년,여성,학업 및 진로,해당없음,상처,"가난한, 불우한",SAD,우리 반 반장은 집안이 좋아서 아무런 걱정 없이 공부하는데 나는 문제집 한 권 사는 것도 엄마한테 쉽게 말 못해. 힘들어하실까봐. 지금은 좋은 배경의 애들이 더 공부를 잘 할 수밖에 없어. 공부 잘해서 성공해야 하는데 이런 배경에선 가능하지 않을 것 같아.,Pro_01776,Pro_01776_00026,E45,S02_D02,
train-014941,train,청년,여성,"연애,결혼,출산",해당없음,기쁨,흥분,HAPPY,뱃속에 아이가 움직이는 게 느껴져서 기뻤어. 발로 차는 느낌이었어. 처음으로 태동을 느끼니 너무 기뻐. 남편과 오늘은 특별한 식사를 해야겠어.,Pro_05276,Pro_05276_00027,E65,S05_D02,
train-030962,train,중년,남성,건강,해당없음,기쁨,흥분,HAPPY,오늘 완치판정을 받았어! 전립선 문제때문에 고민이 많았는데 이제 아무 문제 없대. 그동안 남몰래 많이 눈물도 흘릴정도로 걱정했는데 이젠 너무 기뻐!,Pro_07316,Pro_07316_00007,E65,S09_D02,
train-042847,train,청소년,남성,가족관계,해당없음,슬픔,비통한,SAD,우리 부모님은 나를 무슨 아기인 줄 아나 봐. 간섭 때문에 답답해 죽겠어. 노크도 없이 방문을 벌컥 열어서 매일 깜짝 놀란다니까. 힘들어. 이제 어린애가 아니라는 걸 이해하셨으면 좋겠어. 진지하게 얘길 좀 해 볼래.,Pro_00073,Pro_00073_00033,E22,S01_D02,
train-012803,train,청소년,남성,학업 및 진로,해당없음,기쁨,안도,CALM,나 여태까지 꿈이 없었는데 학교 활동하다 보니 내가 하고 싶은 게 뭔지 알게 됐어. 평생 모르고 살면 어쩌나 했는데 정말 우연히 알게 되었지 뭐야. 앞으로 그 길을 위한 준비를 해보려고 해. 너무 기뻐. 내가 하고 싶지 않은 일을 억지로 하는 거랑 확연히 다르긴 한 거 같아. 진심으로 궁금해서 열심히 찾아보는 느낌이야!,Pro_00238,Pro_00238_00003,E67,S02_D02,
train-012514,train,청년,남성,"진로,취업,직장",해당없음,기쁨,만족스러운,HAPPY,내가 지원한 회사가 정말 마음에 들어. 급여랑 복지 시스템이 좋고 내가 성장하는 데도 큰 도움이 될 것 같아. 자소서를 잘 쓰고 이 회사에 맞게 면접준비를 해야겠어.,Pro_03835,Pro_03835_00007,E64,S06_D02,
train-009054,train,청년,남성,"연애,결혼,출산",해당없음,기쁨,편안한,CALM,결혼을 하니 마음이 안정돼. 물론이지. 이런 편한 감정은 처음이야. 고마워. 이 결혼 생활을 잘 유지해야겠어.,Pro_03714,Pro_03714_00003,E63,S05_D02,
train-011514,train,중년,남성,건강,해당없음,상처,상처,SAD,꾸준히 운동하고 식단 조절해서 건강관리를 하는데 부인은 계속 술을 끊으라고 잔소리만 해. 맞아 나도 노력하고 있는데 계속 부정적인 이야기만 하니까 잔소리 들을 때마다 너무 상처받아.,Pro_07291,Pro_07291_00003,E40,S09_D02,
train-015333,train,노년,남성,재정,만성질환 무,기쁨,만족스러운,HAPPY,부동산을 미리 현금화해 노후 자금으로 잘 쓰게 되어서 기뻐. 부동산은 제때 현금화하기 어려운데 미리 해두기로 한 판단이 옳았던 것 같아. 이 노후 자금들을 허투루 쓰지 않고 현명하게 써야겠지.,Pro_10915,Pro_10915_00007,E64,S13_D02,
train-025889,train,노년,여성,재정,만성질환 무,분노,툴툴대는,ANGRY,정부에서 노인 일자리가 늘었다고 하는데 내가 일할 곳은 없어서 화가 나. 노인정에서 만난 김 씨는 얼마 전부터 소소하게 일하고 있다는데 나도 하고 싶어. 아무래도 노인정에서 만난 김 씨에게 일자리 정보를 어디서 얻었는지 물어봐야겠어.,Pro_12422,Pro_12422_00008,E11,S13_D02,
train-049564,train,노년,여성,"건강,죽음",만성질환 무,분노,성가신,ANGRY,남편이 아파서 돌보는 중인데 너무 힘이 들어. 자식들이 도와주지도 않네. 놀러 가지도 못하고 남편만 돌보니깐 너무 우울해. 내가 사라지는 것 같아. 자식들을 불러서 하루만 돌봐 달라 그러고 나만의 시간을 가지면서 재충전해야겠어.,Pro_12190,Pro_12190_00019,E19,S11_D02,
train-027081,train,노년,남성,재정,만성질환 유,상처,배신당한,SAD,형이 아버지 치매를 이용해 내 재산까지 가로채갔어. 형한테 배신당했어. 형은 나와의 우애보다 돈이 더 중요했나 봐. 난 늘 형을 따랐었는데. 산책이라도 가서 바람을 쐬면 좋아질 것 같아.,Pro_10833,Pro_10833_00016,E42,S13_D01,
train-017719,train,중년,여성,"대인관계(부부, 자녀)",해당없음,기쁨,편안한,CALM,오랜만에 집에 온 딸이 밥도 두 그릇씩 먹고 잠도 늦게까지 푹 자는 걸 보니 마음이 따뜻해져. 응. 딸은 평소에도 잘 먹는다고는 하는데 그래도 혼자선 못 먹는 것들이 많잖아. 데리고 나가 카페에서 커피라도 한잔 하면서 시간을 보내려고.,Pro_08634,Pro_08634_00017,E63,S07_D02,
train-004234,train,중년,남성,건강,해당없음,기쁨,안도,CALM,주위에 안과 질환을 앓고 있는 사람들이 늘어나고 있어. 며칠 전에 검사를 해봤는데 큰 문제는 없어서 안심되네.,Pro_07318,Pro_07318_00021,E67,S09_D02,
train-018570,train,노년,남성,재정,만성질환 무,기쁨,안도,CALM,아내와 나 모두 연금을 받을 수 있는 나이가 되고 생활이 안정적이게 되니까 정말 다행이야. 나 혼자 연금을 받을 때는 사실 고민이 많았어. 연금 나오기 전에 모아두었던 목돈으로 해결해서 다행이야.,Pro_10918,Pro_10918_00005,E67,S13_D02,
train-025538,train,노년,여성,재정,만성질환 유,상처,괴로워하는,SAD,나는 몸이 아픈데 자식들은 관심도 없어. 유산만 차지하려고 해. 나한테는 관심도 없어. 모두를 모아놓고 내 속마음을 말해야겠어.,Pro_12399,Pro_12399_00001,E48,S13_D01,
train-010135,train,중년,남성,"재정,은퇴,노후준비",해당없음,기쁨,신이 난,HAPPY,이제 은퇴 전에 노후 준비 끝이야. 정말 신이 나! 로또에 당첨되었어! 그래서 이제 직장을 그만두고 여행을 다녀 볼까 해.,Pro_07199,Pro_07199_00014,E68,S08_D02,
train-011040,train,청년,여성,"진로,취업,직장",해당없음,슬픔,실망한,SAD,이번에 지원한 회사에서 불합격됐어. 오랫동안 준비했는데 합격이 안 되었네. 앞으로의 진로를 어떻게 잡아야 할지 모르겠어.,Pro_05352,Pro_05352_00029,E21,S06_D02,
train-049302,train,청소년,남성,학업 및 진로,해당없음,상처,질투하는,SAD,요새 게임에 빠져서 공부를 못하겠어. 앞으로도 계속 이럴 것 같은데 어떡하지? 부모님께 혼나도 내가 게임을 끊고 공부를 다시 열심히 할 수 있을지 의심스러워. 청소년 상담센터에서 게임중독에 대해 도움을 받아야겠어.,Pro_00212,Pro_00212_00021,E41,S02_D02,ANGRY_TO_SAD_BY_MAJOR
train-017988,train,노년,여성,"건강,죽음",만성질환 무,불안,걱정스러운,ANXIOUS,내가 세상을 떠나면 나를 그리워 할 사람이 얼마나 있는지 모르겠어. 나는 정작 나는 죽어서 모르겠지만 그런 사람이 없을까 봐 불안해. 그래서 요즘 근래 모임도 같이 나가고 자주 보기는 해.,Pro_12208,Pro_12208_00005,E37,S11_D02,
train-037908,train,청소년,여성,가족관계,해당없음,불안,두려운,ANXIOUS,엄마 아빠가 관계가 진짜 안좋아서 이혼하면 어떻게 하지. 성격이 너무 달라서 그런것 같아.,Pro_01642,Pro_01642_00012,E31,S01_D02,
train-002443,train,청년,여성,"진로,취업,직장",해당없음,기쁨,편안한,CALM,몇 달 동안 고민했던 건데 나 회사 그만두고 이직할 거야. 아직 확정된 건 아닌데 취업할 수 있는 회사가 생겼어. 그래서 이달 말까지만 근무하고 이직해야지. 사실 전공해놓고 전공을 살리지 못해서 그동안 아쉬웠거든. 그래도 좋은 기회라고 생각해.,Pro_05394,Pro_05394_00015,E63,S06_D02,
train-024643,train,노년,남성,대인관계,만성질환 무,기쁨,안도,CALM,지난 달에 아우가 건강검진을 받았다고 해서 걱정했는데 결과를 보니 다행이야. 특별히 이상 있는 곳이 없다고 하면서 술만 조금 줄이라고 했다고 해. 나이가 있으니 건강 문제는 수시로 챙겨야 해. 건강관리를 잘 해야지.,Pro_09838,Pro_09838_00011,E67,S04_D02,
train-036665,train,청소년,여성,학교폭력/따돌림,해당없음,상처,억울한,SAD,오늘 애들이랑 싸웠어. 내가 잘못한게 아닌데 나를 친구들이 피해서 억울해. 어. 다 오해인데 친구들이 나만 피해서 정말 억울해. 그래야겠어. 어서 오해를 풀고 싶어.,Pro_01898,Pro_01898_00023,E47,S03_D02,ANGRY_TO_SAD_BY_MAJOR
train-011173,train,청년,여성,"진로,취업,직장",해당없음,기쁨,편안한,CALM,지금 직장에서는 내 전공을 살리지 못하는 것 같아. 아무래도 직장을 옮겨야 할 것 같아.,Pro_05394,Pro_05394_00041,E63,S06_D02,
train-032861,train,청년,여성,"진로,취업,직장",해당없음,기쁨,느긋,HAPPY,이직 성공해서 마음이 느긋해졌어. 예전 회사는 쉴 틈 없이 일했거든. 종일 일하고 화장실도 미뤄서 갔는데. 이직하면서 쉬면서 일할 수 있고 일에 대한 부담도 줄어서 좋아.,Pro_05397,Pro_05397_00036,E66,S06_D02,
train-014271,train,청소년,여성,가족관계,해당없음,기쁨,편안한,CALM,우리 집은 너무 화목해 늘 대화가 끊기지 않아. 난 사랑 받는 기분이야. 우리 가족만큼 따뜻한 가족도 없는 것 같아. 늘 같은 편이 되어주는 거야.,Pro_01674,Pro_01674_00020,E63,S01_D02,
train-005380,train,청년,여성,"진로,취업,직장",해당없음,기쁨,신뢰하는,CALM,우리 실장님은 참 멋진 분이야. 그분이 하는 말은 다 옳은 것 같아. 본인의 업무를 절대 부하 직원에게 넘기지 않고 스스로 해결하셔. 늘 감사하게 생각해. 우리 팀 실적이 굉장히 좋은 편이야.,Pro_05393,Pro_05393_00022,E62,S06_D02,
train-017078,train,노년,남성,대인관계,만성질환 무,기쁨,안도,CALM,내 며느리는 나이가 좀 있어서 걱정이야. 근데 이번에 건강하게 아주 예쁜 쌍둥이를 낳았어. 며느리에게 고맙다고 말하고 싶어.,Pro_09838,Pro_09838_00004,E67,S04_D02,
train-015629,train,노년,남성,재정,만성질환 무,당황,한심한,ANXIOUS,친구가 도박을 못 끊어서 집도 여러 채 날렸다는 말을 들었어. 당황스럽네. 예전부터 노름판에 끼지 말라고 그렇게 내가 말을 했는데 아직도 못 끊은 모양이야. 뭐든지 간에 도박부터 끊게 만들어야지.,Pro_10909,Pro_10909_00016,E58,S13_D02,ANGRY_TO_ANXIOUS_BY_MAJOR
train-015354,train,중년,남성,"직장, 업무 스트레스",해당없음,당황,고립된,ANXIOUS,직장 사람들과 관계를 맺는 게 점점 지치고 힘들어. 이제는 그들과 얽히고 싶지 않아서 조금씩 거리를 두고 있어. 서로의 심정을 자세히 알면 이 문제를 해결하는 것에 도움이 될 것 같긴 해.,Pro_07422,Pro_07422_00017,E51,S10_D02,SAD_TO_ANXIOUS_BY_MAJOR
train-033665,train,중년,여성,"직장, 업무 스트레스",해당없음,기쁨,신뢰하는,CALM,거래처 수정 요구에 난감했는데 팀장님께서 해결책을 주셨어. 한시름 놓았어. 팀장님은 업무적인 부분에서는 정말 완벽하신 것 같아.,Pro_08993,Pro_08993_00001,E62,S10_D02,
train-043146,train,노년,남성,대인관계,만성질환 유,분노,노여워하는,ANGRY,몸이 좋지 않아 누군가를 만날 수가 없어. 늙으면 짐이 되니까 차라리 죽는게 좋겠지. 이런 몸으로는 친구들도 가족들도 만나러 가봤자 쓸모없는 짐이니 반기지 않을 거야. 그래도 보고 싶으니 연락이라도 해야겠지. 얼굴만이라도 볼 수 있으면 좋겠어.,Pro_09729,Pro_09729_00018,E18,S04_D01,
train-034256,train,청년,남성,"진로,취업,직장",해당없음,분노,분노,ANGRY,내가 동성을 좋아하는 것에 대해 수군거리는 직장 동료들을 보니 화가 나. 직장 동료들이 수군거려도 잘 이겨냈으면 좋겠는데 어떻게 해야 할지 고민이야. 회사에서는 최대한 업무에 집중하고 개인적인 감정을 표출하지 않는 것이 좋을 것 같아.,Pro_03781,Pro_03781_00009,E10,S06_D02,
train-030236,train,청소년,여성,학교폭력/따돌림,해당없음,분노,구역질 나는,ANGRY,학교 폭력 때문에 구역질 나. 응. 이제 날 좀 그만 괴롭혔으면 좋겠어.,Pro_01868,Pro_01868_00022,E17,S03_D02,
train-050537,train,청년,여성,대인관계,해당없음,불안,회의적인,ANXIOUS,요즘 우리 애가 너무 말을 안 들어서 신경 쓰여. 너무 힘이 빠져. 좋은 부모가 돼야지 생각은 하지만 무기력함이 아무것도 할 수 없게 만들어. 부모로서 사랑 실천이 어려워서 앞으로 실천할 수 있도록 노력해야겠어.,Pro_05127,Pro_05127_00024,E36,S04_D02,
train-001183,train,청년,남성,"진로,취업,직장",해당없음,당황,죄책감의,ANXIOUS,내가 사장님 앞에서 큰 실수를 하는 바람에 우리 부서 동료들에게 미안하게 됐어. 내 실수 때문에 우리 부서 동료들이 전부 다른 부서로 발령을 받았어. 내일 팀원들을 찾아가 미안하다고 말해야겠어.,Pro_03826,Pro_03826_00016,E55,S06_D02,SAD_TO_ANXIOUS_BY_MAJOR
train-035501,train,청소년,남성,학업 및 진로,해당없음,당황,외로운,ANXIOUS,요즘 수능 공부한다고 친구들이랑 놀지도 못하고 외로워. 어제 시험도 끝나서 애들이 에버랜드 가자고 했는데 모의고사 준비 때문에 나만 못 갔어. 맞아. 가끔씩은 친구들이랑 놀고 싶기도 한데.,Pro_00224,Pro_00224_00012,E53,S02_D02,SAD_TO_ANXIOUS_BY_MAJOR
train-029010,train,중년,여성,"재정,은퇴,노후준비",해당없음,기쁨,느긋,HAPPY,사람들을 만나는 것이 좋아 카페를 창업하려고 해. 나와 즐겁게 수다를 나누어준 사람들에게는 소정의 선물을 줄까 하는데 뭐가 좋을지 고민이야. 마들렌을 구워서 선물하는 것이 좋을 것 같아.,Pro_08757,Pro_08757_00018,E66,S08_D02,
train-009151,train,청년,남성,"연애,결혼,출산",해당없음,기쁨,편안한,CALM,여자친구를 만날 때마다 마음이 편해지고 잠도 잘 와서 너무 좋아. 응 나한테 편안함을 주는 이 여자친구랑 오래 만나고 싶다는 생각이 들었어. 침대에 누워서 티브이를 볼 때 혼자 있으면 무서운데 둘이라서 편하고 좋아.,Pro_03714,Pro_03714_00013,E63,S05_D02,
train-024226,train,노년,남성,재정,만성질환 유,불안,걱정스러운,ANXIOUS,이번에 정부에서 주는 재난지원금을 못 받으면 약을 살 수 없어. 약이 없으면 몸이 많이 아플 거야. 재난 지원금 받을 수 있도록 노력하고 혹시 못 받으면 친구나 가족들에게 부탁해야겠어.,Pro_10828,Pro_10828_00035,E37,S13_D01,
train-011799,train,청년,여성,"연애,결혼,출산",해당없음,분노,짜증내는,ANGRY,언니는 결혼해서 잘 사는데 넌 뭐 하고 있냐며 항상 구박하셔서 짜증 나 죽겠어. 나는 쓸모없는 사람 취급을 당하는 것 같은 느낌이 들 때가 많아.,Pro_05224,Pro_05224_00033,E13,S05_D02,
train-027865,train,중년,남성,"대인관계(부부, 자녀)",해당없음,기쁨,흥분,HAPPY,오늘 내 첫째 딸 대학 합격 발표날이야. 나도 덩달아 긴장되는데 내색도 못하고 있어. 딸이 지금 엄청 긴장하고 있어. 떨어질까 봐 걱정이 많이 되나 봐. 핫초코라도 타서 가져다 줘야겠어. 조금만 기다리면 되니까 옆에서 관심을 좀 돌려야지.,Pro_07076,Pro_07076_00005,E65,S07_D02,
train-037549,train,청소년,여성,학업 및 진로,해당없음,기쁨,신뢰하는,CALM,나 금번에는 어떤 길로 갈지 결정했어. 스승님이 친절히 말씀해주셨는데 그 말에 나도 공감되고 앞으로 더 열심히 해야겠단 생각이 들어.,Pro_01793,Pro_01793_00001,E62,S02_D02,
train-024331,train,노년,남성,재정,만성질환 유,기쁨,편안한,CALM,병이 있어도 내 집이 있으니 아직은 편안하고 기쁘네. 내 친구를 보면 몸도 불편한데 전셋집을 알아본다고 돌아다니는데 너무 힘들어 보이더라고. 일단 병을 치료하고 난 다음에 생각을 해야겠지만 쭉 여기 살려고 해.,Pro_10854,Pro_10854_00006,E63,S13_D01,
train-014359,train,노년,여성,대인관계,만성질환 유,기쁨,안도,CALM,김 씨가 발작을 일으켰는데 다행히 잘 깨어났대. 엊그제만 해도 건강해 보였는데 무슨 일인지 모르겠어. 내일 김 씨 병문안을 가 봐야겠어.,Pro_11338,Pro_11338_00001,E67,S04_D01,
train-050677,train,청년,남성,"진로,취업,직장",해당없음,불안,취약한,ANXIOUS,내가 잘 할 수 있는 일이 무엇인지 모르겠어. 취직을 하면 계속 출근할 수 있을지도 모르겠고. 내가 우울증이 있거든. 아침에 규칙적으로 일어나는 게 너무 힘들어. 평소 다니던 병원 선생님과 더 얘기를 해봐야겠어.,Pro_03804,Pro_03804_00014,E33,S06_D02,
train-002482,train,청년,남성,"진로,취업,직장",해당없음,당황,죄책감의,ANXIOUS,이번 입사시험도 떨어졌어. 부모님을 뵐 면목이 없어. 준비를 대충 했어. 그래서 더욱 부모님을 뵐 면목이 없고.,Pro_03826,Pro_03826_00040,E55,S06_D02,SAD_TO_ANXIOUS_BY_MAJOR
train-013257,train,청년,여성,대인관계,해당없음,기쁨,안도,CALM,회사에서 야근을 해야 하는데 팀원들이 일을 거들어줘서 빨리 끝낼 수 있었어. 일이 많아서 스트레스받았는데 팀원들이 도와줘서 너무 기뻐. 나도 무언가 해주고 싶어. 밥 사는 건 너무 진부하고 팀원들에게 가벼운 선물을 하나씩 사줄 거야.,Pro_05158,Pro_05158_00050,E67,S04_D02,
train-009497,train,중년,여성,"직장, 업무 스트레스",해당없음,기쁨,만족스러운,HAPPY,이번 달엔 순수익이 천만 원이나 늘었지 뭐야. 지난번에 책도 읽고 강의도 들으면서 연구한 보람이 있는 것 같아. 계속 공부를 하려고. 이제는 공부해야 살아남을 수 있겠더라고.,Pro_08995,Pro_08995_00018,E64,S10_D02,
train-028159,train,중년,여성,"직장, 업무 스트레스",해당없음,기쁨,신뢰하는,CALM,드디어 오늘은 정시에 퇴근을 할 수가 있겠네. 며칠 동안 업무가 많아서 야근을 해서 저녁도 제대로 못 먹었어. 오랜만에 집밥도 만들어 먹고 내가 좋아하는 드라마 정주행 예정이야.,Pro_08993,Pro_08993_00004,E62,S10_D02,
train-003664,train,청년,남성,"연애,결혼,출산",해당없음,분노,성가신,ANGRY,취업한 지 얼마 안 되었는데 자꾸 여자친구가 결혼하자고 해서 성가셔. 다행히 정말 심한 것은 아니지만 이 나이에 뜬금없이 아토피 증상이라고 하는데 놀랐어. 난 생각하지도 못했거든. 앞으로 함께 가정을 꾸리게 되더라도 이런 일이 자주 일어날 텐데 걱정되고 짜증 나.,Pro_03670,Pro_03670_00024,E19,S05_D02,
train-004394,train,청년,남성,대인관계,해당없음,상처,버려진,SAD,나 친구들 사이에서 버림받았어. 내가 친구들에게 잘난 척을 많이 해서인지 싫은 티를 많이 내. 버려진 느낌이 들어.,Pro_03580,Pro_03580_00004,E49,S04_D02,
train-028938,train,청년,남성,"진로,취업,직장",해당없음,분노,방어적인,ANGRY,직장 상사가 오늘 나에게 한마디 했는데 내가 너무 나 자신을 숨기는 거 같다며 내 이야기를 좀 하라고 말을 했어. 난 잘 모르겠는데 그냥 직장에서는 말을 아끼고 싶어서 말을 안 하는 거였지. 근데 직장 상사는 그렇게 느꼈나 봐.,Pro_03785,Pro_03785_00031,E14,S06_D02,
train-012932,train,청소년,남성,학교폭력/따돌림,해당없음,불안,조심스러운,ANXIOUS,나를 계속 때리는 친구가 있어서 다른 학교로 옮기고 싶어. 학교 갈 때마다 불안해. 맞아. 매번 이렇게 주눅이 들어서 학교 다녀야하고 정말 지옥 같아. 제일 좋은 건 학교를 옮기는 거지만 그렇게 할 수 없다면 어른들께 도움을 요청해볼 거야.,Pro_00329,Pro_00329_00006,E38,S03_D02,
train-031396,train,노년,남성,대인관계,만성질환 무,상처,상처,SAD,늙어서 건강한 사람들끼리 모임을 만들었어. 그런데 그 모임에서 만난 사람들이 나에게 상처를 주네.,Pro_09811,Pro_09811_00012,E40,S04_D02,
train-040780,train,노년,남성,대인관계,만성질환 무,상처,상처,SAD,퇴직하고 나니 내 주변에 이렇게 만날 사람이 없는 줄 몰랐어. 친하게 지냈던 것 같은데 직장을 그만두니 만나기가 쉽지 않네. 그러면 될까? 주위에 아무도 없을까 봐 걱정돼.,Pro_09811,Pro_09811_00039,E40,S04_D02,
train-010826,train,청소년,여성,학교폭력/따돌림,해당없음,분노,분노,ANGRY,가장 친한 친구가 같은 반 아이들에게 괴롭힘을 당했어. 친구가 힘들어하는 모습을 보니 그 아이들에게 화가 나. 내일 학교에 가서 선생님께 말씀드리면 해결될 거야. 그 아이들이 꼭 반성했으면 좋겠어.,Pro_01861,Pro_01861_00002,E10,S03_D02,
train-017032,train,노년,여성,대인관계,만성질환 무,슬픔,후회되는,SAD,지금까지 하고 싶은 말들이 많았는데 그걸 다 하지 못하고 살아서 후회돼. 사랑하는 가족들에게 더 사랑 표현을 많이 해줬어야 했는데 그러지 못했어. 더 늦기 전에 지금이라도 집에 가서 가족들을 안아주며 사랑한다고 말해야겠어.,Pro_11354,Pro_11354_00036,E23,S04_D02,
train-026216,train,청년,여성,대인관계,해당없음,당황,고립된,ANXIOUS,오늘 회사에서 나만 빼고 점심을 먹으러 갔어. 혼자 먹게 되니까 당황스러웠어. 왜 먼저 갔는지 다음에 물어봐야겠어.,Pro_05142,Pro_05142_00025,E51,S04_D02,SAD_TO_ANXIOUS_BY_MAJOR
train-044288,train,청년,남성,대인관계,해당없음,당황,외로운,ANXIOUS,회사에서 프레젠테이션을 하는데 자신감이 없어 말을 더듬고 망쳐서 속상해. 많은 사람 앞에서 말하는 것이 점점 더 두려워져. 스스로에 대한 자신감을 가지고 사람들 앞에 서는 연습을 많이 해야겠어.,Pro_03584,Pro_03584_00047,E53,S04_D02,SAD_TO_ANXIOUS_BY_MAJOR
train-021999,train,청년,남성,"연애,결혼,출산",해당없음,분노,성가신,ANGRY,게임을 하고 있는데 여자친구가 옆에서 자꾸 훈수를 둬서 귀찮고 짜증나. 내가 알아서 할 수 있는데 옆에서 이것 저것 지적하니까 너무 스트레스 받아. 여자친구에게 게임을 하는 동안에는 훈수 두지 말라고 이야기 해야겠어.,Pro_03670,Pro_03670_00002,E19,S05_D02,
train-035368,train,청년,남성,"연애,결혼,출산",해당없음,당황,부끄러운,ANXIOUS,내가 우물쭈물 거리고 있는데 여자 친구가 먼저 다가와 사귀자고 고백했어. 내가 먼저 말 못해서 부끄러웠어. 내가 먼저 얘기했어야 했는데 못 했어. 먼저 얘기해줘서 고맙다고 얘기해야겠어. 앞으로 잘해줄 거야.,Pro_03707,Pro_03707_00008,E56,S05_D02,
train-021346,train,청소년,남성,학업 및 진로,해당없음,불안,취약한,ANXIOUS,나는 유독 수학 과목에 자신이 없어 불안해. 수학을 포기할까 생각도 가끔 해. 내가 수학 공부를 다른 과목보다 더욱 열심히 해야겠어.,Pro_00204,Pro_00204_00002,E33,S02_D02,
train-033600,train,중년,여성,"직장, 업무 스트레스",해당없음,상처,상처,SAD,직장에서 대표님께 혼나고 상처받았어. 잘하려고 하는데도 하나씩 안 되는 부분이 있어. 내가 너무 뒤쳐지는 거 아닌가 싶어.,Pro_08971,Pro_08971_00024,E40,S10_D02,
train-037698,train,청소년,남성,학업 및 진로,해당없음,분노,노여워하는,ANGRY,수학 선생님 정말 너무한 거 같아! 기말고사 시험범위에 중간고사 범위도 넣으신다잖아! 그 많은걸 어느세월에 다 공부하라고! 정말 너무하는거 아냐?,Pro_00189,Pro_00189_00011,E18,S02_D02,
train-040578,train,노년,남성,"건강,죽음",만성질환 무,불안,불안,ANXIOUS,건강이 안 좋아 일상생활을 못 해. 한 달 한 달 달라서 무섭고 초조해. 정말 힘들고 사는 게 걱정이야.,Pro_10641,Pro_10641_00001,E30,S11_D02,
train-042116,train,중년,남성,"대인관계(부부, 자녀)",해당없음,슬픔,염세적인,SAD,가장의 능력이 소득수준으로 평가된다는 것은 너무 억울한 것 같아. 근데 또 틀린 건 아니라서 슬픈 현실이지. 어쩌겠어. 더 열심히 사는 것이 최선이겠지.,Pro_07037,Pro_07037_00001,E26,S07_D02,
