sample_id,split,age_group,gender,situation_keyword,physical_disease,emotion_major,emotion_minor,service_label,text,persona_id,talk_id,emotion_code,situation_code,relabel_reason
train-012568,train,청소년,남성,학업 및 진로,해당없음,분노,구역질 나는,ANGRY,선생님이 친구들은 상담을 길게 해줬는데 나만 짧게 해줘서 너무 화가나. 상담 시간이 길었던 친구들은 공부를 잘하고 난 공부를 못해서 차별당한 느낌이야. 정말 역겨워. 엄마에게 시원하게 터놓고 말해야겠어. 엄마가 학교에 건의를 해주실 수 있을 거야.,Pro_00188,Pro_00188_00017,E17,S02_D02,
train-008260,train,청년,여성,대인관계,해당없음,상처,희생된,SAD,오늘 친구가 졸업을 한다 해서 갔는데 황당한 일이 생겼어. 나보고 와달라고 부탁해놓고 더 친한 친구가 왔다고 그 친구하고만 있더라고. 그냥 그 친구의 보험이 된 거 같아 기분이 안 좋네.,Pro_05137,Pro_05137_00037,E46,S04_D02,
train-017316,train,노년,여성,대인관계,만성질환 무,상처,희생된,SAD,몸이 안 좋은 김 씨를 대신해 가게를 봐주고 있어. 김 씨는 가족하고 연락을 안 해서 나밖에 봐줄 사람이 없어. 김 씨 가족들하고 연락을 시도해 봐야겠어. 나도 나이가 많아서 힘들거든.,Pro_11377,Pro_11377_00014,E46,S04_D02,
train-005698,train,중년,여성,건강,해당없음,기쁨,자신하는,HAPPY,난 매일 운동을 해서 건강은 자신 있어. 건강이 중요하다고 늘 생각하고 있었거든. 하루도 빼먹지 않고 운동해. 한번 잃은 건강은 되찾기가 힘들잖아. 평소에 관리하는 게 중요하다고 생각해.,Pro_08880,Pro_08880_00009,E69,S09_D02,
train-045265,train,노년,여성,대인관계,만성질환 무,분노,툴툴대는,ANGRY,의사소통이 되지 않아 나를 외롭게 만드는 사람과 결혼한 나 자신이 너무 한심하고 실망스러워. 예전에 이럴 때 이 사람은 아니라고 생각하며 이혼 해야 했는데 그러지 못한 나한테 실망스러워. 지금이라도 그 행동을 해야 나중에 후회하지 않을 것 같아.,Pro_11342,Pro_11342_00050,E11,S04_D02,
train-015932,train,청년,여성,"연애,결혼,출산",해당없음,당황,외로운,ANXIOUS,출산까지 했는데 너무 외로워. 남편이 바빠서 출산할 때 옆에 있어주지 못했어. 남편을 이해해주면서도 너무 속상하고 외로워 남편한테 말해 봐야겠어.,Pro_05264,Pro_05264_00033,E53,S05_D02,SAD_TO_ANXIOUS_BY_MAJOR
train-014636,train,노년,남성,"건강,죽음",만성질환 무,기쁨,편안한,CALM,평소 호흡기가 약해 미세먼지가 심해서 밖을 돌아다니기가 무서웠는데 오늘은 미세먼지가 없었어. 오랜만에 산책도 하고 좋았어. 계속 이런 날씨가 계속 되었으면 좋겠어. 산책도 하고 건강해 지는 기분이야.,Pro_10674,Pro_10674_00011,E63,S11_D02,
train-034717,train,노년,남성,재정,만성질환 무,기쁨,느긋,HAPPY,몇몇 세입자들한테서 삼 개월 동안은 월세를 안 받기로 했어. 세입자들을 배려해서 한 거야. 다 먹고 살아야지. 이후에도 혹시 아파서 가게를 못 열거나 일을 못 한 세입자들한테는 일 개월 동안 월세를 안 받으려고 해.,Pro_10917,Pro_10917_00005,E66,S13_D02,
train-049922,train,노년,남성,"건강,죽음",만성질환 무,상처,질투하는,SAD,당뇨병으로 건강이 많이 상했어. 앞으로 얼마나 더 견딜 수 있을까? 점점 더 심해지는 것 같아. 내가 다시 정상적으로 일상생활을 할 수 있을지 모르겠어. 한없이 우울하고. 의욕이 안 생겨.,Pro_10652,Pro_10652_00013,E41,S11_D02,ANGRY_TO_SAD_BY_MAJOR
train-021902,train,청년,남성,대인관계,해당없음,분노,분노,ANGRY,내 일을 다 했는데 상사가 자기 일을 나에게 넘겨서 화가 나. 상사라서 거절하기도 힘들어. 정중하게 거절하고 싶어.,Pro_03541,Pro_03541_00005,E10,S04_D02,
train-019698,train,청소년,여성,학교폭력/따돌림,해당없음,상처,질투하는,SAD,방과 후 학원에 안 가고 같이 놀러 다니는 친구들이 부러워. 나도 친구들과 놀고 싶어. 하지만 학원에 가기 싫다고 부모님께 말하는 게 두려워. 내일은 학원에 빠지고 친구들과 놀고 싶다고 말씀드려야겠어.,Pro_01892,Pro_01892_00013,E41,S03_D02,ANGRY_TO_SAD_BY_MAJOR
train-019161,train,청년,남성,대인관계,해당없음,기쁨,안도,CALM,오늘 정말 큰일 날 뻔 했어. 화장실에 갔는데 휴지가 없는 거야. 다행히 친구가 휴지를 가져다 줘서 해결되었어. 하마터면 화장실에 갇힐 뻔했다니까.,Pro_03598,Pro_03598_00014,E67,S04_D02,
train-033848,train,청년,남성,"진로,취업,직장",해당없음,기쁨,감사하는,HAPPY,어제 팀장님의 말로 상처를 받았는데 한편으로는 아주 감사해. 회사에서 경쟁하는 게 힘들었는데 조언을 받으니 더 신뢰가 생겼다고나 할까? 회사에서 경쟁하는 게 힘들었는데 조언을 받아 기쁘셨군요.,Pro_03832,Pro_03832_00020,E61,S06_D02,
train-044788,train,중년,남성,건강,해당없음,슬픔,슬픔,SAD,나이가 들면서 예후가 좋지 않은 심각한 병에 걸려서 마음이 무거워. 장애를 유발할 수도 있다고 하는데 앞으로의 날이 걱정되고 너무 슬퍼. 일단 후유증이 덜하도록 꾸준히 병원에 나가 치료를 받아야겠어.,Pro_07271,Pro_07271_00004,E20,S09_D02,
train-048364,train,중년,남성,건강,해당없음,상처,충격 받은,SAD,또 혈압 때문에 약을 잔뜩 처방받았어. 계속 고혈압으로 숨이 차고 심장이 두근거려서 걱정이야. 식단 조절을 시도했는데 또 실패로군. 고혈압이 나아지지 않아 걱정이야. 건강하게 먹기도 중요하지만 살을 좀 빼기도 해야겠어.,Pro_07295,Pro_07295_00008,E44,S09_D02,
train-046525,train,청년,남성,"진로,취업,직장",해당없음,당황,혼란스러운,ANXIOUS,연봉이 최저임금 수준이야. 내가 뭘 잘하는지도 모르겠어. 학창 시절 때 진로에 대해 고민을 하지 않았던 게 후회돼. 일단 전공부터 다시 살펴봐야겠어. 이럴 줄 알았으면 기술이라도 배워둘걸.,Pro_03830,Pro_03830_00015,E59,S06_D02,
train-047634,train,노년,여성,재정,만성질환 무,상처,희생된,SAD,남편과 둘이 생활하려니 경제적으로 어렵고 더 이상 살아가고 싶지가 않아. 남편이랑 사이도 좋지도 않고 노후준비가 전혀 되지 않아서 절망적이야. 의욕도 없는데 뭘 할 수 있을까? 그냥 포기하고 싶어.,Pro_12457,Pro_12457_00003,E46,S13_D02,
train-036838,train,청소년,여성,학업 및 진로,해당없음,기쁨,흥분,HAPPY,내가 이번에 반에서 일등이래! 일등은 처음 해봐서 진짜 아주 좋아. 응. 잠도 안 자가면서 진짜 열심히 했어.,Pro_01796,Pro_01796_00012,E65,S02_D02,
train-046983,train,중년,남성,건강,해당없음,상처,괴로워하는,SAD,몸이 아파서 그런지 아무 데도 갈 수가 없어. 이전에 추억을 많이 못 남긴 게 아쉬워. 평생 열심히 일했지만 아무 의미가 없는 거 같아. 사진이라도 있으면 좋을 텐데. 지금부터라도 내 삶을 기록하면서 의미 있는 추억들로 간직하려고 해.,Pro_07299,Pro_07299_00015,E48,S09_D02,
train-015897,train,노년,남성,재정,만성질환 무,슬픔,염세적인,SAD,애초에 재테크는 돈이 많은 사람들만 할 수 있다고 생각해. 나는 언제 돈 벌어서 재테크도 해보고 성공도 해보지. 우선 돈을 많이 벌어야겠어.,Pro_10877,Pro_10877_00008,E26,S13_D02,
train-029527,train,노년,여성,"건강,죽음",만성질환 무,분노,안달하는,ANXIOUS,공장 폐수 방류로 계곡의 물고기가 떼죽음 당했다. 이건 내 퇴직전 공장의 비리랑 같네. 빨리 신고해야 하는데. 증거가 없어서 신고를 할수가 없어. 어쩌지? 증거를 찾아야 하는데 큰일났네.,Pro_12187,Pro_12187_00002,E16,S11_D02,
train-030323,train,청소년,여성,가족관계,해당없음,기쁨,신뢰하는,CALM,우리 가족은 나에게 거짓말을 하지 않고 항상 든든해. 가족이 없었으면 얼마나 힘들었을지 몰라.,Pro_01673,Pro_01673_00031,E62,S01_D02,
train-014591,train,청소년,여성,학교폭력/따돌림,해당없음,당황,열등감,ANXIOUS,아이들에게 괴롭힘을 당하는 것 때문에 난 아마 좋은 대학에도 못 갈 거야. 멍청해서 좋은 대학 못 간다는 말을 들었는데 괴롭힘 당하는 것만 해도 그 말이 맞을지도 몰라. 가만히 있지 않고 괴롭히는 친구에게 저항이라도 해봐야 할 거 같아.,Pro_01905,Pro_01905_00012,E54,S03_D02,SAD_TO_ANXIOUS_BY_MAJOR
train-007417,train,중년,남성,"재정,은퇴,노후준비",해당없음,기쁨,신뢰하는,CALM,원금을 잃지 않는다는 점에서 은행에 돈을 넣어두는 게 최고의 방법 같아. 맞아 난 원금이 줄어드는 것을 볼 수 없어서 주식도 안 하거든. 다들 주식을 권장하는데 내 생각은 확고했거든!,Pro_07193,Pro_07193_00012,E62,S08_D02,
train-000456,train,노년,여성,대인관계,만성질환 무,기쁨,안도,CALM,윗집에 사는 총각이 김장을 도와줘서 다행이야. 김장도 함께해 주고 너무나 기쁘지만 가끔 위층에서 층간소음이 들려와. 소음이 발생한다고 조심스럽게 말했지만 김장을 도와줬으니 나중에 한 번 더 소음이 들려올 때 말해야겠어.,Pro_11398,Pro_11398_00012,E67,S04_D02,
train-045296,train,중년,남성,건강,해당없음,당황,남의 시선을 의식하는,ANXIOUS,최근 들어 몸이 너무 피곤하고 짜증도 많아지고 우울감도 생겼어. 내 생각에는 갱년기 같아. 짜증을 받아주느라 고생하는 가족에게 미안하네. 가족들과 함께 여행을 다녀오면 어떨까 생각 중이야.,Pro_07303,Pro_07303_00041,E52,S09_D02,
train-003748,train,청년,여성,"진로,취업,직장",해당없음,기쁨,기쁨,HAPPY,다니고 싶었던 회사에 합격했어! 급여도 예상보다 괜찮고 너무 좋아! 고마워. 동생하고 짜장면 시켜서 먹기로 했어! 친구들도 축하해주고 있어.,Pro_05391,Pro_05391_00011,E60,S06_D02,
train-011699,train,청년,남성,"연애,결혼,출산",해당없음,기쁨,신뢰하는,CALM,여자친구가 성격이 너무 좋아서 결혼하면 잘 살 수 있을 것 같아. 응. 여자친구는 정말 좋은 사람이거든. 평생토록 내가 더 잘해야지.,Pro_03713,Pro_03713_00007,E62,S05_D02,
train-051527,train,중년,남성,"재정,은퇴,노후준비",해당없음,분노,구역질 나는,ANGRY,점점 생계를 책임지는 것이 부담되고 버거워. 이 정도밖에 안 되는 내가 너무 싫어. 아내도 힘들 것을 알면서도 부담감 때문에 자꾸 짜증을 내게 돼. 친구를 만나서 술 한잔하며 스트레스라도 풀고 와야겠어.,Pro_07148,Pro_07148_00023,E17,S08_D02,
train-032753,train,노년,여성,재정,만성질환 무,슬픔,우울한,SAD,아들이 다음 달에 결혼하는데 결혼 비용을 보태줄 형편이 안 되어 우울하고 아들에게 미안한 마음이야. 스스로 해결하는 아들에 대한 고마움으로 우울한 기분을 떨쳐버리고 감사한 마음으로 즐겁게 생활해야겠지.,Pro_12435,Pro_12435_00009,E24,S13_D02,
train-021176,train,청소년,남성,가족관계,해당없음,기쁨,자신하는,HAPPY,우리 아빠 키가 백팔십팔 센티미터래. 완전 크지? 아니 모델은 아니신데. 모델 뺨치게 훤칠하셔 다리도 엄청 길고! 아직은 아닌데. 나도 아빠처럼 키가 커지기 위해 운동을 열심히 하고 있지!,Pro_00120,Pro_00120_00021,E69,S01_D02,
train-005814,train,청년,남성,"연애,결혼,출산",해당없음,기쁨,안도,CALM,오늘 새벽에 아내가 오랜 시간 진통 끝에 아이를 낳았어. 임신 기간 몸이 많이 안 좋아서 출산할 때 힘들까 봐 걱정했는데 무사히 끝나서 다행이야. 어떠한 선물이 좋을지 고민을 하는데 잘 떠오르지 않아.,Pro_03718,Pro_03718_00023,E67,S05_D02,
train-003202,train,청년,여성,"진로,취업,직장",해당없음,슬픔,우울한,SAD,벌써 창업 준비를 시작한 지 이 년이 되어가는데 생각보다 진행이 더뎌서 기분이 우울해진다. 성인을 대상으로 자기 계발 교육을 하고 싶어. 의미가 있는 일이라서 잘하고 싶네. 내가 좋아하는 아이스크림을 먹어야겠어. 기분 전환하고 다시 힘내게.,Pro_05355,Pro_05355_00014,E24,S06_D02,
train-024335,train,노년,남성,재정,만성질환 유,기쁨,신이 난,HAPPY,주식으로 돈을 많이 벌어서 치료비로 대출받은 돈을 모두 갚았더니 아주 신이 나네. 질환 때문에 치료비가 항상 부족했는데 그걸 이번 주식으로 다 갚게 되어서 아주 좋아. 주변에 친한 동생이 있는데 같이 간단하게 술이라도 한잔하고 싶네.,Pro_10859,Pro_10859_00007,E68,S13_D01,
train-039347,train,노년,여성,"건강,죽음",만성질환 무,불안,초조한,ANXIOUS,늙어서 걷기도 어렵고 치매로 정말 힘들어. 만성질환은 회복하기 어려워서 꾸준히 운동하고 있어. 계속 체력단련을 하면 다시 건강을 회복할 것 같아.,Pro_12210,Pro_12210_00010,E39,S11_D02,
train-027895,train,청소년,남성,학교폭력/따돌림,해당없음,상처,충격 받은,SAD,내가 괴롭히던 친구의 형이 우리 작은 형과 친한 친구였단 걸 알게 됐어. 우리 작은 형의 지인이라는 걸 알았다면 괴롭히지 않았을 텐데 후회돼. 우리 작은 형에게 사실대로 이야기하고 그 친구에게 용서를 빌어야겠어.,Pro_00335,Pro_00335_00008,E44,S03_D02,
train-018933,train,청소년,여성,학업 및 진로,해당없음,당황,고립된,ANXIOUS,친구들이 나를 좋아하지 않는 것 같아 친구 사귀는 게 무서워. 차라리 혼자가 편한 것 같아. 친구들과 잘 지내고 싶은데 친구들이 나와는 잘 어울리지 않으려고 하는 것 같아. 선생님께 친구들과 어떡하면 잘 지낼 수 있는지 물어봐야겠어.,Pro_01782,Pro_01782_00033,E51,S02_D02,SAD_TO_ANXIOUS_BY_MAJOR
train-029192,train,노년,여성,재정,만성질환 무,기쁨,편안한,CALM,주식을 삼십 년 넣어놨더니 나는 노후 준비 끝났어. 남은 시간 소중한 사람들과 많은 시간을 보내면서 지내고 싶어.,Pro_12474,Pro_12474_00012,E63,S13_D02,
train-023359,train,중년,여성,"대인관계(부부, 자녀)",해당없음,상처,"가난한, 불우한",SAD,딸이 좋은 대학교에 합격했는데 등록금이 없어서 학교를 포기하고 취업을 한대. 다 내 잘못이야. 딸 대학교까지는 내가 어떻게든 벌어봐야겠어.,Pro_08616,Pro_08616_00015,E45,S07_D02,
train-042221,train,청소년,남성,가족관계,해당없음,슬픔,낙담한,SAD,어머니가 안 계시니까 너무 슬퍼. 왜 나는 남들처럼 평범하게 어머니가 있지 않은 거지? 한부모가정 커뮤니티 같은 곳을 찾아봐야겠어. 나 같은 애들이 또 있겠지.,Pro_00079,Pro_00079_00032,E28,S01_D02,
train-049170,train,청소년,남성,학교폭력/따돌림,해당없음,당황,열등감,ANXIOUS,나는 친구들이랑 함께 있으면 너무 눈치를 보게 돼. 눈치 볼 필요 없이 당당하게 말하고 싶은데 그게 너무 힘들어. 너무 소심한가 봐 사람들 앞에서 말하는 연습을 해야 할 것 같아.,Pro_00345,Pro_00345_00002,E54,S03_D02,SAD_TO_ANXIOUS_BY_MAJOR
train-016665,train,중년,남성,건강,해당없음,기쁨,안도,CALM,요새 소화불량 증세가 나타나서 산책을 하기 시작했더니 좋아져서 다행이야. 처음엔 대수롭지 않게 여겼는데 증세가 심해지니깐 겁이 나더라고. 지금의 식후 산책을 유지하면서 꾸준한 운동과 규칙저인 식습관을 가져야지.,Pro_07318,Pro_07318_00017,E67,S09_D02,
train-034074,train,청소년,남성,학업 및 진로,해당없음,분노,분노,ANGRY,내가 어제 수학 공식을 필기해 놓은 책을 훔쳐 가서 몹시 화가 나. 지금 계속 주변을 확인하면서 찾고 있는데 없어서 열 받아. 같은 반 친구한테 물어보면서 찾아야 할 거 같아.,Pro_00181,Pro_00181_00010,E10,S02_D02,
train-035864,train,청소년,여성,학업 및 진로,해당없음,기쁨,흥분,HAPPY,우리 반 일등이 시험볼때 부정행위를 했다는 걸 알게됐어. 정말 참을수 없이 화가 나. 도저히 참을수가 없어. 내일 선생님께 모두 말씀드릴 생각이야.,Pro_01796,Pro_01796_00028,E65,S02_D02,
train-000202,train,청년,남성,"진로,취업,직장",해당없음,슬픔,환멸을 느끼는,SAD,사내 정치에 환멸을 느껴. 다 같은 월급쟁이끼리 무슨 일인지. 나라도 정신 똑바로 차려서 저렇게 되지 말아야겠어.,Pro_03800,Pro_03800_00013,E29,S06_D02,ANGRY_TO_SAD_BY_MAJOR
train-025620,train,노년,여성,재정,만성질환 유,기쁨,신뢰하는,CALM,천식이 심해져서 병원비가 많이 나왔는데 아들한테 말했더니 바로 보내줘서 너무 고마워. 하나밖에 없는 아들을 봐서라도 질환이 나아졌으면 좋겠어. 열심히 치료받고 면역력 관리를 하는 수밖엔 없을 것 같아.,Pro_12413,Pro_12413_00012,E62,S13_D01,
train-000316,train,노년,여성,재정,만성질환 유,슬픔,후회되는,SAD,나는 자식을 위해 청춘을 다 바쳤는데 자식들은 내가 늙고 아프니 나를 챙기지 않아서 후회스러워. 나는 자식들에게 다 해 줬다고 생각하는데 늙고 병든 내가 잘못이지. 요즘 유난히 부정적인 생각이 많이 들어. 긍정적인 생각을 하려고 노력해야지.,Pro_12374,Pro_12374_00006,E23,S13_D01,
train-036668,train,청소년,여성,학업 및 진로,해당없음,슬픔,후회되는,SAD,내가 어렸을 어째서 이렇게 학업을 안 했을까 후회돼. 앞으로 내 미래가 불투명한 것 같아. 그래도 벌써 늦은 것 같아.,Pro_01754,Pro_01754_00013,E23,S02_D02,
train-046883,train,청년,남성,대인관계,해당없음,슬픔,우울한,SAD,나는 대학 갈 생각이 없는데 엄마가 자꾸 대학가라고 뭐라고 해서 싸웠어. 답답하고 울고 싶다. 설득을 해보려 했는데 전혀 내 말을 안 들으셔. 일단 친구랑 만나서 기분 좀 풀어야겠어.,Pro_03555,Pro_03555_00004,E24,S04_D02,
train-012353,train,청년,여성,"연애,결혼,출산",해당없음,기쁨,신뢰하는,CALM,출산 도우미 아주머니가 너무 마음에 들어! 응! 아기도 너무 잘 봐주시고 일도 너무 척척 잘하시니깐 믿음이 가더라고. 그래서 이번에 선물을 하나 드리려고!,Pro_05273,Pro_05273_00026,E62,S05_D02,
train-009807,train,중년,여성,건강,해당없음,기쁨,안도,CALM,위가 안 좋아서 병원을 오래 다녔는데 오늘 완치 판정을 받았어. 열심히 했지. 특히 식단 조절을 정말 철저히 했어.,Pro_08878,Pro_08878_00018,E67,S09_D02,
train-038512,train,노년,여성,대인관계,만성질환 무,당황,당황,ANXIOUS,노년에 돈이 없어 걱정이야. 나이 든 사람은 사회적으로도 지지가 없어 앞으로 생활비가 걱정이지. 잘못 살았지. 악착같이 돈을 모을걸.,Pro_11381,Pro_11381_00028,E50,S04_D02,
train-043150,train,청소년,여성,학교폭력/따돌림,해당없음,불안,두려운,ANXIOUS,여군 부사관 되려고 부사관 전문고등학교에 입학했는데 아는 애가 한 명도 없어. 교실에서 나 왕따 같아서 애들 눈치만 보고 폭행당할까 봐 당당하기로 마음 굳혔는데 그게 잘 안돼. 애들 앞에서 눈치 보지 않고 자신감을 가지고 친구한테 먼저 다가가야 한다고 생각해.,Pro_01882,Pro_01882_00013,E31,S03_D02,
train-050503,train,중년,여성,"재정,은퇴,노후준비",해당없음,분노,짜증내는,ANGRY,자식들 학원을 보내줘야 하는데 경제적으로 너무 힘들어. 요즘 사교육이 중요하다는데 이런 것 하나 못 해주다니 부모 자격도 없어. 이대로 있을 순 없으니 국가에서 지원해주는 정책은 없는지 한번 알아봐야겠어.,Pro_08704,Pro_08704_00035,E13,S08_D02,
train-028654,train,청년,여성,대인관계,해당없음,기쁨,안도,CALM,내 친구들은 고민을 잘 들어줘. 서로 이해와 공감이 잘 되는 친구들이야.,Pro_05158,Pro_05158_00012,E67,S04_D02,
train-019401,train,노년,남성,"건강,죽음",만성질환 유,불안,당혹스러운,ANXIOUS,눈이 찢어질 듯이 아파서 안과에 갔는데 괜찮대. 기쁘기까지 하네. 다행이지만 스트레스를 받으면 그럴 수 있대. 요즘 내가 스트레스를 많이 받았나 봐. 내 건강을 생각해서 스트레스를 안 받으려고 노력할 거야.,Pro_10586,Pro_10586_00009,E35,S11_D01,
train-007509,train,청년,여성,대인관계,해당없음,기쁨,만족스러운,HAPPY,회사에 새로운 직원이 들어왔는데 정말 만족스러워. 매사에 적극적인 태도를 보이고 심지어 일 처리도 잘해. 내가 사소한 일이더라도 잘하면 칭찬을 해주거든. 그게 동기부여가 된 것 같아.,Pro_05155,Pro_05155_00048,E64,S04_D02,
train-007082,train,청년,남성,대인관계,해당없음,슬픔,낙담한,SAD,인간관계 유지하는 게 너무 어렵네. 다들 나에 대해서 너무 오해를 많이 하는 거 같아. 나는 최대한 친절하게 하려고 하는데 왜 자꾸 오해를 받는지 모르겠어.,Pro_03559,Pro_03559_00042,E28,S04_D02,
train-035572,train,중년,남성,"대인관계(부부, 자녀)",해당없음,기쁨,편안한,CALM,자식이 크면 클수록 부모하고 관계가 어색해 진다고 하는데 나는 우리 아들딸하고 아직도 벗처럼 편안해 이제 고등학생인데도 친구보다 부모님하고 함께 있는 걸 좋아하더라고. 자전거도 타고 배드민턴도 하고 어디 나들이 가서 도시락도 먹고 신나게 놀지.,Pro_07074,Pro_07074_00026,E63,S07_D02,
train-049927,train,청소년,여성,학교폭력/따돌림,해당없음,당황,열등감,ANXIOUS,같은 반 친구를 내가 이유 없이 괴롭히고 때려서 부모님께 얘기해야 하는데 두려워. 내가 잘못했어. 부모님이 화를 많이 내실 거 같아. 진심으로 반성하고 있고 후회하고 있다고 말해야겠지.,Pro_01905,Pro_01905_00001,E54,S03_D02,SAD_TO_ANXIOUS_BY_MAJOR
train-034444,train,중년,여성,"대인관계(부부, 자녀)",해당없음,기쁨,안도,CALM,아들이 군대에서 무사히 제대해서 너무 안심이야. 다 그런 건 아니지만 군대에서 사고도 당한다는 데 이제 안심할 수 있겠어. 본인이 하고 싶은 걸 하도록 옆에서 응원해줘야지.,Pro_08638,Pro_08638_00013,E67,S07_D02,
train-029748,train,중년,여성,건강,해당없음,분노,좌절한,ANGRY,내가 벌써 건강이 악화되었다니 좌절스러워. 맞아. 건강에 너무 신경을 안 써서 그런 거 같아서 운동할 거야.,Pro_08823,Pro_08823_00018,E12,S09_D02,SAD_TO_ANGRY_BY_MAJOR
train-013585,train,청년,여성,대인관계,해당없음,기쁨,느긋,HAPPY,편안하게 별말 없이 함께 산책할 동료들이 있어서 좋아. 편안한 사람들이 함께할 수 있어서 너무 행복해. 좋은 동료들과 커피 한잔하는 것도 너무 좋아.,Pro_05157,Pro_05157_00043,E66,S04_D02,
train-009222,train,청년,남성,대인관계,해당없음,기쁨,기쁨,HAPPY,오늘 내 생일 축하 파티해줘서 너무 기뻤어. 모르고 있어서 더 서프라이즈였던 것 같아. 다음에 나도 똑같이 서프라이즈 해줘야지.,Pro_03591,Pro_03591_00016,E60,S04_D02,
train-004684,train,청년,여성,"진로,취업,직장",해당없음,기쁨,만족스러운,HAPPY,회사에서 상여금이 나와서 너무 기뻐. 맞아. 열심히 노력한 결과인 것 같아 뿌듯하고 만족스러워.,Pro_05395,Pro_05395_00043,E64,S06_D02,
train-006299,train,청년,여성,대인관계,해당없음,당황,한심한,ANXIOUS,오늘 회사 동료랑 싸워서 기분이 안 좋아. 나한테만 너무 가혹하게 굴어서 순간 화를 참지 못했어. 내가 너무 한심해.,Pro_05149,Pro_05149_00028,E58,S04_D02,ANGRY_TO_ANXIOUS_BY_MAJOR
train-013626,train,청년,여성,"진로,취업,직장",해당없음,분노,좌절한,ANGRY,우리 팀장님은 남자와 여자의 할 일이 따로 있다고 생각해서 내가 하고 싶은 일을 할 수가 없어. 너무 답답해. 나는 영업을 하고 싶은데 남자는 영업으로 여자는 행정처리 이런 식으로 일을 구분해. 이전에는 말을 못 했어. 근데 이번엔 얘기를 해볼까 해.,Pro_05343,Pro_05343_00033,E12,S06_D02,SAD_TO_ANGRY_BY_MAJOR
train-012715,train,청년,남성,"연애,결혼,출산",해당없음,슬픔,낙담한,SAD,이제 누군가를 사랑할 자신이 없어서 슬퍼. 내가 너무 한심해서 사랑한다고 해놓고 실망만 시킬 거 같아. 모르겠어. 지금은 그냥 친구들이랑 놀면서 사랑에는 관심을 꺼야겠어.,Pro_03679,Pro_03679_00027,E28,S05_D02,
train-040824,train,노년,여성,대인관계,만성질환 무,분노,분노,ANGRY,난 내 외모가 정말 싫고 흉측하게 느껴져 몇 년 전 화재 사고 후에 모든 게 망가졌어. 집에만 갇혀 사는 게 요즘은 너무 외로워. 치료받다가 포기했어. 도움 주던 사람들도 내가 다 끊어냈는데 그랬던 나 자신이 원망스러워.,Pro_11341,Pro_11341_00019,E10,S04_D02,
